问题id,页码,答主昵称,答主性别,答主粉丝数,答主主页,答主签名,回答id,回答时间,评论数,点赞数,喜欢数,回答内容
654972428,1,新的开始,男,1717,https://www.zhihu.com/people/luo-guo-dong-56,135兔兔246神神周日休息,3492270041,2024-05-09 04:48:03,219,5784,191,我经常看B站直播。据我观察，这事出了后，不但情侣分手，直播的老板都跑了不少，或者都不刷礼物了。估计也是受这个案例警醒，不当舔狗了。
654972428,1,金剩炭,未知,286,https://www.zhihu.com/people/yudaiyan,脑海里开着潜水艇,3489054962,2024-05-06 08:35:12,462,8992,257,情侣看了这新闻，各自都觉得不对劲。男性因为女朋友像谭竹要分手。女性因为男朋友不像胖猫要分手。
654972428,1,村长,男,274,https://www.zhihu.com/people/cun-chang-82-86,,3492238392,2024-05-09 04:23:18,121,4879,121,想起之前《消失的她》，那些走出电影院就给男朋友甩脸子的
654972428,1,lyx,男,258,https://www.zhihu.com/people/lyx-42-68,做梦都想赚钱，想着发财的男人,3492490478,2024-05-09 07:39:16,518,3776,111,前公司女同事，晚上突然找我聊天，聊着聊着就说自己饿，说让我请客，我说没钱，你请我先。她说不行，我没理她了。后面上班的时候，又叫我请她喝奶茶或者请她吃饭，我直接讲我没钱。她说她不信，又叫我请她吃饭。我直接一个字回她：“滚”
654972428,1,天天吃面条,未知,4600,https://www.zhihu.com/people/liu-yang-90-91-24,你好，请问充电器哪里有卖？,3493835232,2024-05-10 10:49:08,37,2432,76,因为死了。
654972428,2,东营男大,男,705,https://www.zhihu.com/people/--47-63-67-20,我只是个普普通通的大学生,3489149143,2024-05-06 09:59:44,131,7036,232,前天去KTV唱歌，有妹子过来要微信，都挺开心的，就留了妹子的微信，第二天上午给我发微信问我起了吗，我说起了，然后说想喝奶茶，我回都没回直接删了，你想喝奶茶你自己买去就是的，我又不是嫩爹，喝奶茶还要给我汇报吗？
654972428,2,提桶不跑路,男,709,https://www.zhihu.com/people/lin-yin-da-xia,10年工地狗,3488944076,2024-05-06 06:44:40,25,2417,57,胖猫以命入局，警醒世人。舔狗们都集体觉醒了，爱人先爱己，谋爱先谋生。
654972428,2,虎达利,男,5216,https://www.zhihu.com/people/hui-ge-49-52,,3492195317,2024-05-09 03:49:29,156,1843,122,胖猫事件只是完成了针对国内多年的畸形婚恋观的最后一击，在此之前这种趋势其实早已暗流涌动，就差一个节点，一起标志性事件，实现一个总爆发。这是一个旧时代的结束，以及另一个新时代的到来。男性拒绝当供养者，这一步日本早在20年前就已经走完了，这个历史趋势必然会到来，或早点或晚点而已，它甚至不以人的意志而转移，谁也无法阻挡。
654972428,2,庄世敦,未知,48,https://www.zhihu.com/people/ling-bo-ren-81,公众号【光素数学】,3492249740,2024-05-09 04:32:22,52,1655,47,胖猫和谭竹是情侣吗？他们做了什么情侣间该做的事了吗？谭竹的行为妥妥的就是诈骗犯罪。很多所谓“情侣”，摸着你们的良心再说一遍，你们真的是“情侣”吗？
654972428,2,平沙落雁飞,男,115,https://www.zhihu.com/people/tli2014,,3493025326,2024-05-09 16:33:19,75,1618,59,可怕的是谭竹一个极端例子么不是是晚上众多支持谭竹的女生
654972428,3,clearlove114514,男,393,https://www.zhihu.com/people/19331200770,,3491050574,2024-05-08 03:59:11,126,2214,66,一个真正爱你的女孩子，是会自己穿上婚纱去找你的。
654972428,3,叶牧风,男,2144,https://www.zhihu.com/people/xie-mu-feng-98,但见此心无别处，一叶飞扬牧清风。,3494481278,2024-05-13 11:37:32,56,1418,38,客观上胖猫被动当了一次中国婚恋市场的谭嗣同。其实应该是陈天华更合适。
654972428,3,小小粥,女,292,https://www.zhihu.com/people/xin-nian-nian-33,,3491566096,2024-05-08 11:02:59,42,2626,65,女：我们分手吧男：为什么？女：胖猫爱他女友，所以拼命赚钱，转了51w给谭竹，你呢，转过多少给我？你压根就是不爱我男：我们分手吧女：为什么？男：胖猫对她女友这么好，最后落了一个这样的下场，我不敢相信爱情。
654972428,3,殷浩天,男,107719,https://www.zhihu.com/people/yin-hao-tian-55,所有命运赐予的礼物都应该在高位变现,3495441769,2024-05-12 01:06:21,380,2170,116,昨天在X看到的，一些给X上的福利姬上供的性压抑男士们也觉得有点绷不住了，开始质问福利姬对于胖猫事件的看法。结果福利姬们却是一副关我啥事儿的无所谓态度，让这些老哥彻底破防了。经过这个事件，我感觉福利姬们的门槛费和图包收入都要大打折扣。这些福利姬们虽说收了不少老哥的供养，但好歹回馈了一些打胶用的图包以及时不时聊天给点情绪价值，相比谭竹还是有些基本的商业道德。我是觉得这种单方面的给女主播or女黄推上舰长过门槛的行为其实象征着一种单方面的爱恋，因为哪怕不花钱看到的内容也差不多，花钱了无非是能和她们产生更多的交集和互动罢了。可现如今这些男的一想到胖猫，内心多少都会升起一些大头战胜小头的坚强意志吧，至少以后会去耐心找免费的资源，而不是傻乎乎的给她们打钱去填补自己脑中的想象空间。
654972428,3,六道绝形踪,女,453,https://www.zhihu.com/people/2-95-54-58,图灵测试不过者勿扰,3491174370,2024-05-08 05:34:16,54,1623,63,因为男性越看越觉得女朋友有谭竹的影子。而女性越看越觉得男朋友怎么做不到胖猫那样。
654972428,4,ForEverglow,男,136,https://www.zhihu.com/people/yin-huang-chen,,3492774736,2024-05-09 11:49:50,25,1043,20,很多集美看完“消失的她”不也单方面分手了么这次感觉是集帅先动的
654972428,4,鸟雏先生,男,862,https://www.zhihu.com/people/niao-chu-xian-sheng,,3492690550,2024-05-13 09:31:08,69,985,32,我在soul上面遇到个女的，想着见一面，她问我去哪儿，我随便说了个公园，我想着你觉得不行可以换，或者你想去哪儿就去哪儿，都没问题，可丫直接开骂“你是有什么大病吗”，咱也不惯着她，直接给丫举报拉黑了，然后她被系统禁言了。然后，他另一个小号又过来骂我，说我小气，骂完把我拉黑了。给爷气笑了，是你要让我说去哪儿的，我说去公园你不想去可以换地方，或者你直接跟我说想让我请你吃饭也行，可你直接开骂，你都把“给钱”俩字写在脑门上了，哪个傻子能上钩？然后我又把她小号也举报了，禁言，拜拜了您嘞。
654972428,4,TAN,未知,629,https://www.zhihu.com/people/tan-67-9,,3493233674,2024-05-10 00:37:55,10,936,17,女的：为什么你不学学胖猫男的：为什么你这么像谭竹
654972428,4,旅仙生,未知,1376,https://www.zhihu.com/people/zhen-ren-lu-you,好吃懒做的专业食客，一直在旅行的艺术收藏家,3490486654,2024-05-07 16:55:59,906,2850,153,真没必要花心思鉴别女方是不是捞女。你就把握住一个原则，无论女方找什么借口跟你要钱或礼物，你别给就行了。如果她因为你不给钱就闹分手，那就说明她是捞女，你在她眼中的价值就是取款机，分了也没什么可惜的，早点止损。捞女都是男人的懦弱和卑微一步步惯出来的，不知道拒绝女人，越到后来越难回头，直到被榨干。这就是胖猫用生命给世人的警示。可能这些分手情侣本来的模式就是谭竹胖猫，现在胖猫们决定及时止损了，谭竹们看再继续下去也捞不到了，等不到榨干的那一天了，就不演了，再去找下一个胖猫。
654972428,4,摸鱼大队长,未知,1392,https://www.zhihu.com/people/he-chun-guang-90-85,土匪就是土匪，怎么粉饰都没用，土匪基因刻在骨头里，草台班子,3494124709,2024-05-10 15:40:26,65,973,22,说那么多，还不是男的没那么多钱，哼
654972428,5,郭德纲,未知,417,https://www.zhihu.com/people/guo-de-gang-32-40,,3492450842,2024-05-14 05:18:07,40,965,46,女性现在是已经清醒觉醒，独立的走向成长的道路上，希望广大男同胞们能够自信起来，睁眼看世界。不要因为破防了之后，骂骂咧咧，哭哭啼啼。
654972428,5,花与时光同眠,男,4598,https://www.zhihu.com/people/hua-kai-cheng-hai-70-39,做了这行，真是看遍世态炎凉,3494310269,2024-05-11 13:36:47,128,984,32,我老婆体制内我在家待业两年这两年我老婆以各种各样的借口给我发红包，怕我没钱用~~~~~我跟我老婆不是江西嘛！当初她家要彩礼16.8，然后我老婆回去跟她爸妈拍了一晚上桌子要降低。这事我感觉这辈子都欠她的
654972428,5,老陈,男,128,https://www.zhihu.com/people/stupid-yang-7,人不与犬争,3492701066,2024-05-09 10:50:40,76,771,27,我和我对象只是一起震撼怎么有人能挣50多万全部拱手白送他人，对家人却毫不顾及。这个谭竹甚至都没采用什么高级骗术，就是一直“哥哥，打钱”。
654972428,5,李耀,男,28,https://www.zhihu.com/people/li-yao-62-69,非皇汉的汉民族主义，虽然讨厌一些东西但是不会为豺狼虎豹带路,3492392165,2024-05-09 06:13:15,52,947,33,臣有一言，主公何不把钱都冲进三国杀？漢室兴复，指日可待！
654972428,5,执笔,未知,358,https://www.zhihu.com/people/zhi-bi-43-43,,3492048994,2024-05-11 13:44:00,396,1779,130,胖猫事件的女主谭竹，我有可能认识……翻聊天记录翻到的，已经被拉黑头像很眼熟，她还问我要过一只口红，我以前不在重庆但是偶尔打游戏也喜欢点陪玩好险，差一点上新闻的就是我前几天发了抖音 现在TZ已经换了头像 补上一位知友的分析，我觉得挺有道理的。她没骗到我，这些年我在女人身上经历过的坑数不胜数，都能写一本书了。TZ这种方式也只是为了筛选目标群体而已，我前任们大部分都比TZ有手段有谋略，我自己身上也有很多重量级的瓜不输胖猫，只是没被曝出来。但是我的心理承受能力很强大一直坚持到了今天。胖猫不同，他没什么和异性相处的经历，也不多才是导致今天这样后果的原因。男人只要多当几次买单侠和司机侠就能长记性了，这种低级的手段也就骗不到了。
654972428,6,大份薯条,未知,53,https://www.zhihu.com/people/dauntlessrooster,是有点搞笑，但你得服从,3493798551,2024-05-10 10:20:15,51,1558,53,因为这是一次男方兜售赎罪券的绝佳机会，不论卖不卖都会给女方造成心理上的压迫感就好像之前唐山打人案一样，明明是很极端的个例也不妨碍很多女性在朋友圈怒斥和规训男性如何如何，叫男性更多让利，现在男性反打的机会来了就会让有些女的受不了要是这事件性别反转一下，涉事未深的小女孩被大六岁的男人骗走两年辛劳收入后自杀，我都不敢想女性能骂出什么新高度来
654972428,6,秋水它是水,男,12927,https://www.zhihu.com/people/wangzuzong,qstss,3492305705,2024-05-09 05:13:28,8,688,25,你以为ta 们是情侣其实ta 们可能是饭搭子、炮搭子、ATM、舔狗、冤大头、老实人、备胎离婚率都能逼近 60%情侣分手跟离婚相比，更加简单分手置换率，估计得到个 90%了吧算是大型二手情侣交易市场了，习惯就好
654972428,6,haolin he,男,10555,https://www.zhihu.com/people/haolin-he,我直呼我直呼,3493437196,2024-05-10 05:12:57,117,729,21,我真的觉得某些中国的男人好没有骨气，为了C个B什么都能忍，我甚至怀疑他们会为了女人出卖兄弟
654972428,6,快乐的大脚,男,13547,https://www.zhihu.com/people/guan-lao-shi-233,这个人很懒，啥也没写,3493278751,2024-05-10 04:23:23,15,654,21,男人看了这件事后会觉得：卧槽，这人真可怜！女人看了这件事后会觉得：你看别人，给女朋友花了51万！你呢？垂死病中惊坐起，胖猫竟是我自己。
654972428,6,丁蟹,男,2931,https://www.zhihu.com/people/dai-zhao-cong-8,新能源电力工作者,3495780072,2024-05-12 07:34:20,47,566,12,你永远可以在垃圾桶里看见全新的红玫瑰，但极少看见全新的​康乃馨
654972428,7,明天又是新的一天,男,2603,https://www.zhihu.com/people/a-bai-9-82-97,本是后山人，偶做前堂客。  醉舞经阁半卷书，坐井说天阔，,3492609628,2024-05-10 05:12:55,4,569,13,根据简单的概率学就知道，胖猫绝对不是最胖猫的。只不过胖猫死了，所以上新闻了。Ps，很感谢一个人算我放弃没让我胖猫
654972428,7,卧薪尝胆,女,222,https://www.zhihu.com/people/jiu-guang-bo-he,理想主义的信念，现实主义的人生，be humorous,3490776320,2024-05-14 07:47:59,30,554,21,因为他用血的事实向世人证明 ，现在这个版本老一辈们所说的好女怕缠郎是行不通的，价值匹配之后，真诚才有意义，不然的话，只是ATM罢了，人财两失。
654972428,7,平凡男人,男,3554,https://www.zhihu.com/people/zhang-chang-chun-7,银行资深搬砖人。,3492979687,2024-05-09 15:36:23,36,438,15,我很好奇，这么一段简单的话，统共200个字不到，你们都说了啥直击灵魂的话让评论直接点都点不开了……
654972428,7,缘辰,男,13462,https://www.zhihu.com/people/yuan-chen-42-24,把认真你就输了这句话挂在嘴边的，往往是赢不了又输不起的人。,3491992257,2024-05-08 18:44:36,68,552,56,因为胖猫事件是典型的完全一方在付出。你别看胖猫被拿捏得死死的，但是，主动权还在他这里。因为他是花钱的，所以只要他哪一天想通了，不花钱了，这段关系就可以立刻结束，没有任何现实的阻碍。这就是花钱的人的权利。就像男女相亲，为什么女性被要求立刻做出反应，不允许在相亲中慢热。如果在相亲的时候还要慢热，就会被嘲讽呢？因为她相亲的时候不出钱，是男方一个人在出钱。不出钱的人没有资格慢热。相反，如果她AA把钱出了，那么她想慢热是可以的，对方只能选择等不及了退出，却不能指责女方。就像男A女免的局，不出钱的女人默认就得被在座出钱的男性带出去上床。如果违反这个潜规则，纯吃吃喝喝玩玩，而且不能够活跃氛围，让其他人开心的。不好意思，第二天第三天就被请出去了，你和咱们这群人玩不来。这个时间长短可能和女方的颜值，能不能活跃气氛，有关系。但无论如何，女方没有资格什么都不做。这就是因为她没出钱。所以，因为胖猫事件分手的情侣，也是这个原因。因为和胖猫事件类似的情况，都是男人在单方面的出钱，因此他们具有极大的主动性。只要他们因为胖猫事件想明白了，立刻就可以结束这段感情，他们不欠任何人的。相反，有些人说看《消失的她》分手的情侣和这个一样，这就没搞清楚本质。当然不一样，因为很多情侣去看电影，还是男人多出的钱。拿钱的人没资格想来就来，想走就走。除非你说女方完全供养男方，出去玩都是她出钱，或者起码是AA制，那女方当然可以说直接分手，这个就一样了。所以为什么很多情侣分手了？因为这些所谓的情侣，男性的付出占极大部分，因此只要他们想明白了，女方没有任何能力阻止他们离开，甚至还会因此遭受损失。比如生活失去供养无法适应，甚至男方索要借款，等等。所以，任何感情里面，只有同等付出，才能有同等地位。付出巨量金钱却被人拿捏的，只不过是心里没想明白罢了。只要他们想明白，一切都不是另一方能够挽回的。
654972428,7,胖胖的小超人,男,126,https://www.zhihu.com/people/tim-wang-66,,3495094128,2024-05-11 12:49:09,22,404,9,现在这个事情是国际事件，越南纪念奠边府大捷都没这件事热度大，越南麦当劳因为这个事情乱蹭热量让越南人给冲了你敢信？越南姑娘给胖猫在河内西湖送外卖你敢信？这件事分分钟飞出东盟走向欧盟啊。这回那些漂亮姑娘可真是小刀拉屁股开了眼了，这可不是蓝海，这蓝色太平洋啊我们这里的女孩被国家移民局和边境海关保护的太好了。若再不收敛，过两天国版蝴蝶夫人，越南姜文主演的人在上海都要上线了。
654972428,8,三一真人,男,4,https://www.zhihu.com/people/geng-yun-zhe-42-2,人不行不要怪路不平,3493463821,2024-05-10 05:32:22,2,411,13,枪毙刘青山，张子善的时候，教员说，这是在挽救二十个，两百个，两千个，两万个在犯不同程度错误的同志!
654972428,8,苇丝麦苔木,男,3084,https://www.zhihu.com/people/42-82-11,别跟别人讲道理，少说话,3489059113,2024-05-06 08:39:06,89,1416,38,年轻的网友总有个错觉：一个人的影响力可以很大很大。捞女和国服的事，这几年发生好多起了。真有那么多前车之鉴的事，高中生还背什么《阿房宫赋》《过秦论》《氓》。
654972428,8,爱着太阳的星辰,男,2895,https://www.zhihu.com/people/hei-tu-zi-74-5,,3496080303,2024-05-12 14:10:10,16,424,10,外网上对喷已经开始用“娶一个中国老婆”来诅咒对手了虽然还不多，但效果已经比下地狱还要让对手破防了。
654972428,8,Temo Alen,男,33651,https://www.zhihu.com/people/temo-alen,喜欢游戏，宗教和乱七八糟的事情。,3493521314,2024-05-10 10:42:42,186,2108,178,我想到了一部电影，叫《了不起的盖茨比》。里面还出过一个表情包：简单说下剧情：城里有一个土豪叫盖茨比每天在豪宅淫趴不断，人人羡艳。但是盖茨比实际上是个纯情男人，曾经的梦中情人是豪宅对面的黛西。再一次机缘巧合下，“男主角”黛西的表哥成了第一个被盖茨比邀请进入淫趴的人（其他人是进来就能免费玩），盖茨比以男主为跳板，邀请了黛西，黛西二话不说放弃了在外面到处留情的丈夫来豪宅给丈夫汤米带了一个月绿帽子。因为对黛西百依百顺，盖茨比几乎倾家荡产，但是黛西还是在汤米喝盖茨比之间犹豫不决，直到汤米和盖茨比正面对决，汤米一句话让盖茨比破防：“一个乡下臭要饭的，来我们纽约打工来了！”原来盖茨比的工作就是给黑帮老大“做信托基金”（炒股——感谢评论指正，是贩卖私酿酒），而汤米是个old money贵族，家里不用上班就有花不完的钱。亲眼看到盖茨比破防，黛西立刻放弃了“努力上进但是有暴力倾向”的盖茨比选择了“很感性（指到处开淫趴养二奶）而且懂生活（指不上班就能从家族收到钱）”的汤米。汤米趾高气昂的离开，让盖茨比乖乖送黛西回家。路上不幸撞死了刚刚被发现出轨的盖茨比家花匠的老婆。撞死花匠老婆的是黛西，但是盖茨比希望黛西幸福顶了罪。偷情花匠老婆的是汤米，但是汤米让盖茨比为这事背了锅。盖茨比从一个“勤奋的乡下卷王”成功发财，因为爱上了不该爱上的人以“勾引别人老婆（黛西），在外养情人（花匠老婆）的人渣”身份被花匠枪杀。盖茨比为了初恋黛西付出了无数个日日夜夜的努力换来的金钱，地位，甚至为她顶罪，最后获得了什么呢？一颗子弹。胖猫为了一个恋人，选择放弃了无数个日日夜夜的努力换来的金钱，时间，甚至为她开店，最后获得了什么呢？男生最怕的就是黛西，花你的钱还要在外面找男人勾三搭四觉得自己没错；女人最恨的就是男生，给的别说不如肥猫多，他甚至不愿意顶个杀人罪。两方一沟通：“啊，钱要完了还要我命？”“啊，假设问题而已居然拒绝了？那就分手！”“不分手等着你花光我的钱害死我？”两年给五十一万，最后网络上的评价是“不听姐姐的”“不懂事”“自私”，只能说舆论对捞女可太有利了。女方勒索诈骗男性的时候都是“女性不会用自己的XX说谎”“不要要求受害人是‘完美受害人’”，到了男方受害就是“就算她有百分之九十九的问题，难道男方就完全无过错？”既然谈恋爱必须男方掏钱，为什么不直接用金钱换性资源呢？
654972428,8,fhtjk,男,300,https://www.zhihu.com/people/fhtjk,,3493073274,2024-05-09 17:34:03,23,470,26,本来心里都清楚，只是不愿意承认，都互相演戏，这事出来，捅破了那层纸，我在dy看到太多已婚女搭讪外国人的，她们对自己的丈夫完全没有任何感情
654972428,9,晨曦,女,260,https://www.zhihu.com/people/xi-chen-er-73,,3494865766,2024-05-11 09:25:40,7,450,16,《消失的她》一出，很多女的不也分手了微博上骂，胖猫给人家花了五十万，你花了几个子儿你好意思带入胖猫？那消失的她里面李木子还是个白富美，男主赌博欠一屁股债她摆摆手就能还清倒是你，四十块电影票都有可能是男友买的，你搁哪儿带入呢？我去微博小红书逛了逛，类似“电影票四十块钱都是男友买的，你好意思带入李木子”这种评论，很少，就算有（比如我在逼乎发的），流量也惨的可怜
654972428,9,我已经无了zwx,男,655,https://www.zhihu.com/people/ceng-wu-xian,暴躁乐子人，也不是什么都懂,3492966491,2024-05-09 15:19:40,0,346,6,因为这下胖猫真的先生赴死了。。。
