问题id,页码,答主昵称,答主性别,答主粉丝数,答主主页,答主签名,回答id,回答时间,评论数,点赞数,喜欢数,回答内容
654972428,33,家里有只熊,男,19288,https://www.zhihu.com/people/yang-guang-32-34,克己,3494535850,2024-05-11 04:45:27,1,19,0,胖猫事件一出为什么很多情侣都分手了？这标题是怎么敢的？很多是多少？数据支持在哪里？情侣分手与此事件具有关联性是如何得出的？调查过多少样本？啥也没有，张嘴就来啊？退一万步讲，就算真有傻鸟情侣因为网络上一个素未谋面，八竿子打不着的人的故事分手了，那也是他们自身存在问题，本来就长不了。没有胖猫，也会因为胖狗、胖熊、胖虎分手。
654972428,33,安之,未知,1618,https://www.zhihu.com/people/an-zhi-31-33-53,,3494762046,2024-05-11 07:41:40,1,12,0,不知道，但是我这有个炸裂的兄弟们一定想看。吃饭的时候刚看到这个问题，就让渣男哥们发给我了。女的今年27岁，在哥们描述里（看过视频），身高163，体重110，那又白又圆，超出D的范畴了，两个人是在公园认识的，然后第一次约出来，是晚上11点在凤城二路那边公园见的，我记得那天描述里，是在公园除了那啥，基本上别的都进展了。然后就是后面的各种进展，而这个女的，烧的一手好菜，看起来很顾家那种也不知道如今互联网是怎么打分的，如果按照美颜后的说，这女的样貌8分吧，妆后6-7分，如果说素颜最多3分，毕竟皮肤状态在那里摆着，昨晚吃火锅的时候，看到了，个人感觉评分吧，可能每个人不一样。然后，炸裂的来了别说情侣分手，就是TM的P友都要分的啊！看着他们的聊天记录，你会感觉很扯，也很搞笑，一个是出着P资去睡，一个认为自己不是M，要索取 ，奇葩吧！上周我记得是两个人去了乐华城走了一套流程，然后是个520，去那边玩的都知道，乐华城的动物城+游乐园+酒店套票。试探了很多次，都只是把这女的定义为高级那么一丢丢的小姐，毕竟生活就是每天打麻将出去玩，结果没成想，今天刚才我们吃饭那会才知道是个有老公的 你说什么情侣分手，不知道，真不知道这事会这样，但是你要是说夫妻离婚，这样的，如果不是时间管理大师，真的是百分百离吧！
654972428,34,鹿鹿路西法大人,男,3625,https://www.zhihu.com/people/naron-35,未来的心理咨询师，潜力股，随缘关注～,3493184517,2024-05-09 20:14:34,4,13,0,因为这个事件启发了人们去审视自己的恋爱、婚姻是否存在剥削关系。以前认为合理、本该如此的事情，结果弄死了人……人类的同情心，会让自己和死者产生相似的绝望感和窒息感，在这种焦虑造成的生理性紧张中，人会开始反思和悟道，以寻求一种能消除紧张的思路。国内网络上有一股势力，在极力避免人们去同情胖猫，因为害怕同情心会激发更多的人思考“亲密关系中的剥削”这一他们从未思考过的课题。舔狗不舔了，伴侣要求经济自主了，榜一不咵咵刷火箭了，不仅直接影响剥削者的利益，连带还会影响直播平台、轻奢礼品的盈利和贩卖。
654972428,34,暂时想不起来,未知,1551,https://www.zhihu.com/people/zan-shi-xiang-bu-qi-lai-36,平等的厌恶每一个性别，本科以下谢绝回复。,3491961146,2024-05-08 18:14:49,0,4,1,胖猫事件让我意识到，爱于被爱这个课题，很多人都完全不懂，深受其害。胖猫就是典型的不懂情感的青少年，过不了情劫。很想开个教程，如何识别捞女，或者性别对换也可参考。还是以胖猫为例，如果胖猫遇到一个正常的，爱他的女生，该会是怎样的。首先，健康的感情，一定是双向奔赴的。胖猫是个慷慨的恋人，但慷慨不能没脑子，更不能抱着我给她钱，她就会爱我这种思想，千万别，永远不能。一开始你可以给她一些钱，一些礼物，这没问题，问题在于，她要不要回馈你。我建议事不过三，如果三次之后，她没给任何让你满意的回礼，你就得好好掂量了。但你也搞清楚，你买礼物付出的这个人，一定是你喜欢的，心甘情愿的，你别说是你见一个爱一个，是个女的你都行，那你这种广撒网行为导致花钱太多，那就是你的问题，不是性别对立的问题。女性对你有感情，一定是有付出性的，聪明点的女性会投其所好的给你买东西，呆一点的女生可能就只会给你买一些她认为好的东西。你喜不喜欢另说，但一定是她会对你付出。如果前期这种双向付出的关过了，你再考虑，要不要把更多的钱，或者财政给她。你一定要注意看她把前花在哪，比如胖猫这种，他们像奔着结婚去，那么她有没有真的在把你的钱存起来，哪怕这女的是铺张型的，但她多少必有会有一笔钱存起来，给你看着，为你们结婚做准备。就算她喜欢出去消费，但她一定会同时给你买好东西。（消费观契合这种东西是另一个话题，这里只说防捞女的基本法则）胖猫这种异地的更是谨慎付出，骗子高发。比如把胖猫一直丢出租屋这是什么操作。有情之人，一定是希望岁岁常相见的。换句话说，她一定会想法设法多陪着你，而不是让你一直自己呆着。其次，女生如果真的爱你，一定是看不得你太劳累的，胖猫这种拿命工作的，工时就摆在那里，换做我老公，今天你特么无论如何也得给我把手机放下，什么扣押金我给你赔，你现在给我立刻，马上，吃饭，睡觉，第二天出去玩，陪我玩，必须，见见太阳。平时工作完给你松松肩，辛苦了辛苦了，一定是会打心眼里心疼你，想办法让你劳逸结合。另外，虽然不赞同秀恩爱，到秀恩爱的本质是：你是我骄傲的存在，在我眼里你就是这么闪闪发光。比如胖猫这种，哪怕只是会玩游戏。展示出去：我男友是国服诶，看他带我玩游戏的战绩。哪怕是金钱问题，我男友玩游戏挣好多钱，给我买了啥啥啥。不管怎样，她一定会很稀罕的展示你的好，会让你整个人都自信开朗起来。胖猫太可怜了，接单子拉生意说的都是，我很便宜，老板点我。这孩子太自卑了，完全没有被珍爱过的痕迹。健康的爱一定是会让人熠熠生辉的，胖猫明珠蒙尘完全没有在闪光过样子才让去如此惋惜。个人认为，这事的主要问题出在青少年教育，拿这事搞男女对立的脑子都有泡。
654972428,34,李夏洛克,男,1766,https://www.zhihu.com/people/lixialuoke,偷心小贼不请自来,3492984153,2024-05-09 15:41:58,0,1,1,因为经济背影不允许了。你一个月收入五万，你家猫要吃进口猫粮，要用智能饮水机，要住手工猫窝；现在你失业了，猫还喵喵叫着要吃进口猫粮，你怎么买？你买了你自己还活不活？说白了就是前些年经济好，部分女性从男的这里要什么就有什么，妇女节还不够，要女神节、女王节，秋天要第一杯奶茶，化妆品要全套48色口红礼盒。旅游要去马尔代夫巴厘岛。为了什么？最后就为了P个图发个定位朋友圈。摸着良心问自己，有几只口红用光了？剩下的不都是放在那里最后扔掉。去旅游是住在五星酒店，网红店、景点打卡，还是真的去体验当地风土人情？经济好的时候无伤大雅，钱花了还可以再挣；现在人人自危，男的没法再那么花钱了。一说精神就是独立女性，一说物质就是彩礼红包，双标玩得太6了。就跟巨婴青少年一样，个人自由看欧美，花钱的时候又指望父母一直帮衬。经济不独立的孩子，你问他有“自由独立”的资格吗？同样的道理，人家女富婆夜夜男模，又有谁说人家不对了？你一个月5w你会在乎别人给你买杯奶茶的“态度”吗？现在不就是两边各玩各的，按部分女性的说法，不结婚不谈恋爱自己多开心，那这么大性别比到底是谁在着急？网上的信息就是纯粹幸存者偏差，线下红娘机构已经连35岁以上女性的简历都不收了。你说这是歧视？真的不是人家歧视，谁会跟钱过不去？实际上是因为根本没人愿意相，匹配不到人，最后女方还觉得人家不干活，还得起诉退款，人家干脆就不给自己找麻烦。就跟职场一样，有些小仙女真以为自己能力突出但是全世界都歧视女性压迫女性，要不是有女的一入职就休产假，谁会放着牛马不压榨？经济下行，部分女性的处境只会越来越难。不然你以为日本小电影界那么多女的全都是被逼的吗？
654972428,34,朱定好律师,男,22737,https://www.zhihu.com/people/zhu-ding-hao-33,军事观察员/法律、金融分析师/战略问题研究者/电影哲思爱好者,3492566518,2024-05-09 08:56:46,1,21,1,双向参照系。习惯于当舔狗的看到胖猫的结局，瞬间觉醒了、开悟了，舔狗舔狗，舔到最后一无所有。没有体会过胖猫一样过于付出的女生，看看胖猫，再对比下自己男朋友，我草，这人对我的付出不及胖猫十分之一。爱情，本身就是互相骗的游戏，但凡有一个人人间清醒，这游戏就玩不下去了。
654972428,34,Blueeyes,未知,4057,https://www.zhihu.com/people/fen-da-38-40,有掀桌子的能力 VS 不掀桌子的修养,3489252146,2024-05-07 06:48:55,17,17,0,这个事情，像是一个【照妖镜】，反映出来很多事情，唤醒了不少类似群体，看外卖给胖猫的有多少，异地支援有多少，这类人群就有多少，一般都是程度深浅罢了。外人一看，就知道这个事情肯定会发生的。可以代入和共情的人；一般都是舔狗体质（无论男女），感情内的低自尊，讨好者的角色，情侣相处，都是付出贡献与收益都是10-0开，或者9-1开那种，非常失衡，供给方和索取方；而且他们深刻的感觉到，转账一停，感情归零。这样的感情不叫爱情，叫单相思/不健康的畸形关系，而且这样无底线投入，都是无底洞，对方都在在骑驴找马ing，有更好的下家和新的ATM机，当事人很容易被断崖式分手了，对方可以无缝衔接，唱歌蹦迪约旅游，你的死活对方根本不在乎。但是某些群体捞男捞女就不一定了，会哄你，说好听的，提供廉价的情绪价值，和你要钱，不关心你的死活（你住狭窄出租屋，吃最便宜的外卖，一天16小时工作，对方都无动于衷），直到榨干你（骗完你所有的钱财），直到丢弃然后换下一个。
654972428,35,日向家的大小姐,女,12949,https://www.zhihu.com/people/chang-jing-lu-chi-liao-na-duo-hua,爱是常觉亏欠，不是常觉亏本。,3492010625,2024-05-08 19:08:36,16,12,0,因为他们没有爱。啥玩意是爱？看我签名。
654972428,35,李哲爱吃蛋炒饭,男,2851,https://www.zhihu.com/people/74-17-29-65-43,黔首皆持三尺剑，不教人间出帝王。,3493002771,2024-05-09 16:05:54,0,18,1,看到那么多先烈用血浇筑出的真相，很多男人终于开始长脑子了。
654972428,35,AirPosture,未知,435,https://www.zhihu.com/people/xun-qiao-41-85,工科博士,3497828642,2024-05-14 06:20:22,2,1,0,我从大一到现在博1，大概约会过50个女孩子。其中不和我a的只占一小部分。当然，可能以前没有小红书，最近约会几个零零后确实不太有aa的意识。
654972428,35,一米月儿,男,518,https://www.zhihu.com/people/jie-tong-60,辽宁省作家协会会员,3490989913,2024-05-08 02:55:48,12,20,8,文/桔彤其实，胖猫事件，之所以让很多情侣分手了，那是因为让很多单方面付出的男人越来越觉醒了，很多人看明白了一个道理，时下捞女，渣女太多，依靠着自己所谓的物质条件来满足和留住爱情，本来就是不靠谱的，更是不现实。当然截止今天，自从这个21岁的清纯小哥哥跳河以后，事情的女主已经给男方那边退了部分钱，估计也是互联网的压力，以及舆论的压力，铺天盖地而来，也让那个女主禁不住各种压力，良心未泯，来退钱，但是理想很丰满，现实很骨感，这仅仅是女方良心发现而已。退一步来说，即便是女方一点钱也不给男方退钱，也是无可厚非的事情，说白了胖猫事件的这个男主，一点也没有觉得值得可以同情的地方，说白了，可怜之人必有可恨之处，毕竟他不是一个十几岁的一个小孩，应该能对自己行为负责任，毕竟成年人的世界，应该对自己负责。即便是大家咒骂，胖猫事件的女主，给她戴上很多标签，比如捞女，渣女，但是这样的对于男主来说，也是没有任何意义，因为男主并不值得同情，而且没有人可怜你，这是成年人的世界。这里也给很多青年人，尤其是恋爱的年轻人上了一课，不断的要红包，要礼物，要化妆品，名包的女人都是物质女，在她们身上过多的投入也是没有任何意义的。因为这个世界上，总有比你更有钱的男人，所以呢，最不值钱的就是一贫如洗的真心，和一无所有的爱，没有一个女人会因为，你有10元，你给她花9元而感谢你，所以双向奔赴才有意义，也是爱情的王道。无疑，胖猫事件也给男人敲响了警钟，爱情的事情上，一定要擦亮眼睛，避免陷入其中，让自己家破人亡。
654972428,35,付律说时事,男,3508,https://www.zhihu.com/people/tu-xiao-tiao-11,律师、纪检委前干部。法律咨询、公考规划、职业规划、重大抉择。,3494918957,2024-05-11 10:12:37,0,23,1,大概有四种：女方：他对我没有胖猫好——分手女方：原来我还可以学习谭竹——分手男方：她很多做法与谭竹相同——分手男方：她让我学胖猫，自己想学谭竹——分手
654972428,36,电子厂厂长,男,2341,https://www.zhihu.com/people/bu-ai-chui-niu-bi-de-cao-lao-ye-men,路漫漫其修远兮，吾将上下而求索,3493665384,2024-05-10 08:19:24,0,0,0,信任危机罢了说实话，作为一名男性，我对胖猫感到惋惜，却并不同情高中的时候，也就是2011年，那个时候男女对立的矛盾并不尖锐，也没什么拳师，但是当时我已经了解到了跟女性相处下去的定律可以宠，不能惯尤其是不能当舔狗(虽然当时没有这个词)人性本就如此，你越软弱，越觉得你可欺，你越退步，对方越要在你头上拉屎，无论男女无论何时，都要保持脑袋的清醒，恋爱脑的结局大概率是死局，小概率事件根本没有讨论的意义恋爱中的双方一定是平等的，如果你感觉到了不平等，请尽快纠正过来，如果为时已晚，请尽快放弃，别傻不拉几等对方感受到你的好，等他回心转意，都是放屁真正感念你好的人，是你放低姿态的时候，他愿意托起你，是你对他好的时候，他也愿意全心全意的对你好，仅此而已祝各位都能找到自己合适的伴侣，反正我找到了
654972428,36,柠檬的柠,男,1043,https://www.zhihu.com/people/ning-meng-de-ning-36,一个什么都能扯的项目工程师,3494531824,2024-05-11 04:42:16,0,33,1,男：她怎么共情谭竹，可怕，赶紧跑女：他怎么还不如胖猫，恶心，赶紧滚
654972428,36,清风白浪s,男,69,https://www.zhihu.com/people/song-kun-peng-70,,3495495751,2024-05-11 23:19:12,5,47,0,说过多少遍了。单身生育就是版本最优解。50多万在东南亚或者东欧都换俩混血儿了。
654972428,36,乌U内存不足,男,24,https://www.zhihu.com/people/caspar-j,,3493375919,2024-05-10 04:24:45,0,26,3,胖猫用生命证明了舔狗不得house，还残存一点自尊的舔狗也该为自己想想了。
654972428,36,火花石头,男,1488,https://www.zhihu.com/people/huo-hua-shi-37-63,创业，项目总监,3492233996,2024-05-09 04:19:53,0,4,0,大概是发现了对方的套路和胖猫聊天记录里的是一样一样的吧。
654972428,37,绾绾,未知,170,https://www.zhihu.com/people/shi-yang-yu-ya-84,,3494037895,2024-05-10 13:46:01,0,14,0,每次一有感情相关的新闻，就是一场大型的三观对轰，三观不合该分的趁机都分一分了，免得以后又吵
654972428,37,猫是没有坏心思的,未知,1710,https://www.zhihu.com/people/mao-shi-mei-you-pi-xin-si-de,爱猫人士 吃瓜大户,3497493895,2024-05-13 21:34:02,0,8,0,想多了，没几个真是因为胖猫分手的会卡在这个时间段分手的情侣，大多之前就有矛盾，胖猫事件只是个借口罢了现实是日子该怎么过还怎么过，很多人甚至都不了解这事儿（我单位的八卦群里都没人提，也就我闲着无聊说了一下，其他人反应：啊？啊？啊？）我以前也认为网络上的所谓大事，一定会跟现实接轨，之前227事件够出名了吧，那传播力度看着跟冲出宇宙一样，感觉是个人就应该听过，但实际上，周围只有我最亢奋，其他人要么不知道，要么不感兴趣，搞得我也挺没劲的现在我明白了，现实里要想让大家一起兴奋起来，只有在关乎大众利益的时候，比如菜价上涨
654972428,37,Jeremy,未知,2500,https://www.zhihu.com/people/jiao-fu-57,生理性别男心理性别女，异装癖所以男装，同性恋所以喜欢妹子。,3496884176,2024-05-13 09:26:03,0,12,0,当初斐迪南皇储遇刺的时候，大多数人都以为这只是一场普通的行刺。
654972428,37,宋乾,男,76,https://www.zhihu.com/people/yi-ming-94-95,如果只允许一种声音存在，那么它一定是谎言。,3492252203,2024-05-09 04:34:11,13,102,1,出事前全网都在说舔狗不得house真应验了又在那里惺惺作态悼念拧巴
654972428,37,天天给你讲段子,男,199,https://www.zhihu.com/people/ying-jun-89-4,,3495590149,2024-05-12 03:58:44,26,57,9,来川渝跳莎莎舞吧，带你家的男孩子去去魅，省得以后做沸羊羊。
