问题id,页码,答主昵称,答主性别,答主粉丝数,答主主页,答主签名,回答id,回答时间,评论数,点赞数,喜欢数,回答内容
654972428,98,忙坏了的蝼蚁,未知,61,https://www.zhihu.com/people/mang-pi-liao-de-lou-yi,冷眼览繁华,3492956527,2024-05-09 17:02:17,0,3,0,上大学对我改变最大的一件事就是，我不再把人当人看了。以前下课骑自行车，路上满满的一大群人。现在？那些人和其他物体区别不大了，我要做的只是不撞上他们。我只会注意到善良朴实的人，他们值得。他们才值得我的关怀。但他们也不算人，只是我的宠物。什么是善良朴实的人？举个最直白的例子，一份很普通的资料，A不由分说就给你，B对你百般刁难戏弄最后还是不给你。也许有人会说A这种人容易被欺负，B聪明独立有底线；他们还会说A这种人最后必定对你有所求，B往往在关键时刻挺身而出。但请问这特么关老子屁事啊？我要做的就是保护A这种人，就像保护以前的我自己，让A在低谷的时候有人搭把手，不要变成B这种悲哀的时刻算计的样子，也就是现在的我自己。顺便，B这种人，惹了我我就报复回去，没惹我直接无视掉就好，不要把这种人当人看。只有我的家人才算人。只有他们，才值得我的无条件奉献。我愿意为我的父母做任何事情。以前不一样。以前我是把所有人都当家人看的。细化到女生，尤其是那种花枝招展的，那就更不一样了。非我族类其心必异。我是带着警戒的态度的。以前也不一样。最早是默默暗恋好几年，稍早是幻想破灭只剩生理驱动，有性无爱。你问我青春萌动的问题怎么解决？我口袋里的手机上，原神，碧蓝航线，各种小网站，现在还有AI，哪个不能满足我？说到这个我也不一样了，刚进大学满脑子都是这种事，现在对女人的希望破灭之后基本上很少想了。究其原因，我觉得是个人原子化带来的结果。没有交流，何来信任？你问我结婚率生育率？只能说塔自作自受。但凡有一点正常的疏导，适当的接触，我就既不会“刚进大学满脑子都是这种事”，也不会像现在这样完全失去恋爱结婚的愿望了。玩过头了。说到这个，还有不一样的就是对塔越来越失望。太无能了。真的太无能了。又让马儿跑，又让马儿不吃草。哦你一边喊着要防止经济脱实向虚，要产业升级寻找新增长点，一边坐视踏实出力的人被空手套白狼的人劣币驱逐良币。你一边喊着要提高生育率结婚率，一边玩这种吊着胡萝卜赶驴跑的缺德事。这不闹吗？就是既要又要。我也有苦衷的啊，我也特么曾经是弱小无助的老实人啊？要是这比赛有规则能让我踏踏实实研究我手头上的事，谁愿意天天算计人啊？哪个B以前不是A啊？你可能会说人牛爵爷就是天生的大恶人，那好，这又是另一套玩法。人大英这些天生的大恶人实际上最终霍霍的都是殖民地的老实人的利益，人家允许他们满世界霍霍；哪有像你这样可着劲往自己家里倒垃圾的啊？搞清楚重点，这些所谓的牛人牛是牛在他们能争取利益而不是能欺负人！正常家长的选择：你牛，你能，你是小辈们的老大！行！你给老子上外边牛去！别整天在家里欺负弟弟妹妹们。有本事把别人家给我抄来。？的选择：让最大的孩子待家里做监工，监管弟弟妹妹们给别人家出苦力就算了，还特么在哥哥姐姐欺负弟弟妹妹的时候不出手管教，还美其名曰野蛮生长，反过头来还指责弟弟妹妹们还不是你们不努力。我可去你的吧！好，以前你可能说这是迫不得已。那时，家里的窘况每个小辈都看在眼里，你为小辈们出头争面的过往大家也都记在心里，都是心甘情愿为这个家出力，忍一忍就算了。好，现在，现在阔了，不一样啦。你当上了全村首富了。小辈们指着你带大家过好日子呐。可你为什么还在那里叫苦？我们为什么还是在被哥哥姐姐欺负？其他家长都看不下去了，其他家长说以前我们帮衬你这个穷邻居，是因为你当年为全村正义事业鞠躬尽瘁。现在你发了，坏人早没了，你还躺功劳簿上嚣张起来了，好我不帮你了！你现在慌了，你终于记起应该让大儿子出去闯一闯。可是大儿子常年待家里只会欺负弟弟妹妹，哪有这个胆气啊？你只能一面继续变本加厉捡软柿子捏，一面支持大儿子。可弟弟妹妹们，就苦咯···我说句公道话，妹妹们变成这样也是有苦衷的。现在全世界都面临同样的问题：正常的女大学生找不到正常的就业出路。还记得那个梗图吗？一上一下，上面的图片：立志成为xxx！下面的图片：我下海啦，大家多多支持哦！正确的做法是把天生的坏女人放国外去闯荡，有本事你去霍霍外国的冤大头。然后呢，正常女人踏实出力，在哥哥姐姐们抢回来的产业上工作，这是个正循环。可能每个家庭姐姐们能力大小不一样，但是你不能，鼓励支持保护姐姐们欺负弟弟们。现在的情况是，坏女人可着劲霍霍国内傻傻的男性，塔还鼓励支持引导保护这个玩法。所以，既然能毫不费力地欺负弟弟来赚钱，那为什么还要出去闯荡呢？结果就是，正常女人等不到正常的工作机会。这是个负面循环。那她们能怎么办？你说那些正常女生会怎么选择？一个A越来越少，B越来越多的社会，注定无尽内卷下去。可能这就是内循环吧，我看不懂但我大受震撼。 
654972428,98,Pelery,男,179,https://www.zhihu.com/people/ni-tian-er-xia,日常怀念ap剑圣,3492739326,2024-05-09 11:21:20,0,2,0,以我对公司内年长男性的聊天，一大堆根本没有性魅力，戴个眼镜，长的不高微胖，也不打理，穿简单的衣服。一般就是相亲谈一个价格，女方那边觉得价格够了就勉强在一起，根本就没有自由恋爱过程，也没怎么跟女生约会过。这就是传统婚姻的模式，男生赚钱，女生忍一忍，搭伙过日子。这也是很多现在恋爱的本质，女生除了图男生的钱别的根本没得图。但是恋爱的本质是动物的原始冲动，是人的特质，外貌，气味，声音，触摸，谈吐，智慧，这才是女生真正需要的，国男应当在这个方向进步。
654972428,99,小太阳,未知,5,https://www.zhihu.com/people/mu-mu-76-20-35,,3492567068,2024-05-09 08:57:15,0,2,0,能因为一个热点分手的要么心怀不轨，要么脑子没发育好男生觉得自己对象像谭竹女生觉得自己对象不像胖猫
654972428,99,绫波丽,未知,17,https://www.zhihu.com/people/ling-bo-li-2,,3492391429,2024-05-09 06:12:47,0,3,0,有多少情侣因为这个分手了？很多是多少？哪里有统计数据吗？题主从哪里得到的信息？没有数据支撑，咱怎么回答你的问题嘛。。。。。。
654972428,99,张乐乐,男,13,https://www.zhihu.com/people/zhang-le-63-23,,3492138526,2024-05-09 02:46:15,0,3,0,忽觉得这个世界的最终版本是男的跟男的过，女的跟女的过，互不干涉
654972428,99,一语q,未知,731,https://www.zhihu.com/people/yi-yu-q,佛系,3491142401,2024-05-08 05:11:50,2,4,0,先看聊天记录‼️‼️‼️网图，侵权删网图，侵权删网图，侵权删网图，侵权删网图，侵权删网图，侵权删网图，侵权删官方发声网图，侵权删胖猫事件导致许多情侣分手的原因可以从多个角度来理解：1.社会热点事件的考验胖猫事件作为一个社会热点，其背后的争议和舆论压力对情侣关系构成了巨大的考验。情侣们在面对这样的社会事件时，可能会在态度、观点和应对方式上产生分歧，这些分歧若未能妥善处理，可能导致关系破裂。 2.价值观上的不合：事件引发的一系列讨论暴露了情侣间在价值观上的不合，如对肥胖、宠物、责任等问题的看法不一。这些看似细微的差异在情侣关系中可能成为难以逾越的鸿沟。3.社交媒体的影响社交媒体在胖猫事件中的角色不可忽视。其匿名性、即时性和碎片化特点容易导致人们在面对争议事件时产生过激言论和行为，这些行为可能对情侣关系产生负面影响，甚至导致分手。4.心理和社会层面的压力在快节奏的现代生活中，人们面临巨大的压力和不确定性，可能导致在面对争议事件时产生焦虑、恐惧等负面情绪，进而影响情侣之间的关系。 5.﻿﻿﻿个人情感与金钱的双重打击特定案例中，如胖猫与谭竹的关系，揭示了情感与金钱的双重打击是导致分手的重要原因。谭竹利用胖猫的善良和单纯，不断索取金钱，最终提出分手，给胖猫带来了极大的情感伤害 。 6.家庭背景与性格因素的影响胖猫的家庭背景和个人性格特点也影响了其处理感情的方式。父母离异和性格孤僻使得他在感情中缺乏安全感，更容易受到伤害。当遭遇分手时，这种脆弱性可能导致极端行。7. 真实情况的曝光另有报道称，分手的原因之一是女方公开表示自己是女同性恋，并计划与另一位女性离开，这表明了双方之间存在不真诚的情感基础。综上所述，胖猫事件导致许多情侣分手的原因是多方面的，包括社会热点事件的考验、价值观上的不合、社交媒体的影响、心理和社会层面的压力、个人情感与金钱的双重打击、家庭背景与性格因素的影响，以及真实情况的曝光等。
654972428,99,三岁哥哥,男,545,https://www.zhihu.com/people/yi-yi-xue-zhi-shi,情感,3491124923,2024-05-08 04:59:11,0,4,0,近日，“胖猫事件”在网络上引起了广泛的关注。这一事件不仅引发了人们的热烈讨论，更意外地导致了越来越多的人分手。这究竟是为什么呢？让我们一起来探讨一下。“胖猫事件”可能成为了一些情侣关系的导火索。对于某些人来说，这一事件可能引发了他们对于价值观、生活态度等方面的思考。如果双方在这些问题上存在较大分歧，可能会导致矛盾的激化，最终走向分手。此外，“胖猫事件”也可能让一些人重新审视自己的情感需求和关系。这一事件可能让他们意识到，在一段关系中，双方的价值观和生活方式是否契合是非常重要的。如果发现彼此在这些方面存在无法调和的差异，他们可能会选择分手，去寻找更适合自己的人。同时，社交媒体的传播也可能对人们的情感产生影响。在“胖猫事件”广泛传播的过程中，一些人可能会受到周围人观点和态度的影响，从而对自己的关系产生质疑。这种外界的影响可能会加剧情侣之间的矛盾，促使他们做出分手的决定。当然，“胖猫事件”并不是导致分手的唯一原因，每段关系的结束都有其复杂的背景和个人因素。然而，这一事件无疑给我们提供了一个思考的契机，让我们更加关注情感关系中的问题和挑战。最后，我想说的是，无论是分手还是继续走下去，都需要我们认真思考和对待。每一段感情都是宝贵的经历，都能让我们成长。希望大家都能在感情中找到真正的幸福。以上就是关于“胖猫事件”后越来越多人分手的一些分析和思考。如果你对此有什么不同的看法，欢迎在评论区留言分享。也希望大家能够珍惜身边的人，用心去经营每一段感情。
654972428,100,和悦,未知,277,https://www.zhihu.com/people/he-yue-36-61-32,世间很好但是不再来了。,3494377120,2024-05-11 00:56:59,0,4,0,早就说过，老一辈给年轻人挖的都是坑整天脑子里都是生个带把的、带把的、带把的现在报应来了吧
654972428,100,养猪联系1518731,未知,53,https://www.zhihu.com/people/tian-qi-37-59,,3497790945,2024-05-14 05:56:56,0,3,1,因为有屌丝男把自己想成胖猫了呀醒醒，你这种给女生发红包都没有的男人是比不了胖猫了你们连自己老妈都不爱更别说别人了
654972428,100,埃罗蓝阿,女,80,https://www.zhihu.com/people/xiu-she-xiang-cao-fen-lan-79,遵守无规则 信奉无信仰 混乱善良,3493932998,2024-05-12 14:06:39,0,3,0,这个世界上，不是所有的人都是人。在恋爱中，捞女想要的是钱，捞男想要的是性。但我们都不是神，我们都不知道自己爱的这个人是不是一个好人，特别是在没谈过恋爱的时候，遇到了自己喜欢的人，就只会使劲的给，对方想要什么就给什么。直到你看清了对方的面目下定决心要离开。感情中，你的付出都是投资，那些钱，那些爱，如果给了错误的人，就是沉默成本。你只能认栽。但那些骗人的人，骗感情骗爱骗钱的人，他们不配拥有你的爱，他们不是人。我知道承认自己爱错了人很痛苦，但你没有错，错的永远都是那些恶心的阴沟里见不得光的家伙。爱需要小心翼翼的给。但请你记住，给别人爱永远是一件伟大的事情。如果你对象因为这件事要跟你分手，你应该庆幸自己看清了一个错误的人。那些算计都是旁观者清应该明白的道理，如果当局者也清，那ta根本不爱你。正真的爱，不会计较自己付出了多少。我爱你，我当然会给你你想要的东西。这不丢人。丢人的是那些取笑你人，是那些拿着你的爱扔到垃圾桶里的人，他们才丢人。但还是请你先保护好自己，爱人先爱己。寄言痴小人家女，切勿将身轻许人。
654972428,100,李用真,未知,526,https://www.zhihu.com/people/li-yong-zhen-35-98,一等人勤民孝子，两件事读书劳神,3497926872,2024-05-14 07:42:27,0,3,0,因为胖猫的本质是这个时代的“谭嗣同”，一个被动性的成为“谭嗣同”的人，在一个女性思维离“利益最大化”的“后现代”不远，男性思维却停留在“双重责任”和“双重义务”的“近代”的国家，他替所有的中国男人流了血，献祭给这“利益最大化思维”主导时代，中国男人没有理由不因为这血而去摆脱“近代理想”的束缚，去走向“利益最大化思维”的“后现代”之路。
654972428,100,过河卒,未知,23,https://www.zhihu.com/people/guo-he-zu-16-7,,3497885283,2024-05-14 07:01:03,0,2,0,因为有些男性开始觉醒了，知道睁眼看世界了，这是好事儿。
654972428,101,噜噜啦噜,女,4,https://www.zhihu.com/people/21-2-44-71-54,,3497804626,2024-05-14 06:05:53,0,2,0,因为看到这个事件就分手的 大概率本身就不是正常恋爱
654972428,101,Lumpenproletariat,未知,190,https://www.zhihu.com/people/lumpenproletariat-5,物质不灭，不过粉碎罢了。,3497445421,2024-05-13 19:20:56,2,2,0,大家要珍惜你请她吃饭，她主动说：“要不我请你喝奶茶吧？”的女孩。大学的时候遇到过这种女孩子，我们都是普通家庭，出去也不是很奢侈，请一顿饭两个人最多吃五六十元；两杯奶茶（喜茶、茶百道之类）也就三四十。记得一次去逛公园，两个人走的脚累，回程几乎是苦行军似得走回地铁站，刚好我看到一辆共享电动车，半小时的行程，我们两个人挤在小小的座位上十分钟就到了，一路上的崎岖、曲折、蜿蜒、都是在笑谈中度过。这种女孩不把你当atm，认为双方都要付出才能长长久久。
654972428,101,夏天Alex,未知,10,https://www.zhihu.com/people/alex-37-4-51,,3497419461,2024-05-13 18:46:25,0,2,0,女的觉得没遇到胖猫，分手男的觉得遇到谭竹了，分手到底是哪一方在觉醒
654972428,101,精神科白主任,男,48,https://www.zhihu.com/people/2022-27-9,咨询另外收费,3497361094,2024-05-13 17:33:03,0,2,0,看小冰冷评论区前很同情胖猫看完，世道险恶过好自己吧
654972428,101,烟雨江湖,男,317,https://www.zhihu.com/people/yao-yao-8-53,我要做回高贵观众，不开心就拉黑删评,3497239805,2024-05-13 15:20:10,0,2,0,情侣啊，说明人年轻。脑子好使的朋友直接说网友就是这群人play的一环，pm这热度高到不正常，重庆…地域黑+南拳+铝拳…简直buff叠满。网上还有一群人嚷着让小日子再炸一遍重庆的…他说这就是乌合之众，不带脑子那种
654972428,102,实名用户,男,27,https://www.zhihu.com/people/wpld-44,,3496978940,2024-05-13 10:45:59,0,2,0,跟消失的她一样，恩恩爱爱，天长地久的情侣不会因为一部电影就分手本来就应该分手的所谓情侣，即使没有这些电影跟事件，最后也会分手。
654972428,102,一往而深,男,33,https://www.zhihu.com/people/cheng-cheng-65-72-23,初级码农，努力生活的小市民,3496741892,2024-05-13 07:00:42,0,2,0,如果真的出了这个事就很多人分手，那真是太好了，因为这些情侣该分。就怕不是这样，就怕这事儿像一滴水流入大海，根本没什么波澜
654972428,102,四爷,未知,524,https://www.zhihu.com/people/ren-xin-yu-10-17,天天向上,3496677836,2024-05-13 06:18:53,0,2,0,童锦程祖师爷：钱是给女人看的，不是给女人花的拳师退散
654972428,102,李林,未知,7,https://www.zhihu.com/people/guo-hang-chen,历史老师,3496576116,2024-05-13 05:03:49,0,2,0,你调查过吗，张口就来，有几对情侣因为这事分手了，没有胖猫事件也有情侣分手啊。
654972428,102,驱蚊法师,未知,33,https://www.zhihu.com/people/su-gang-guo,机器视觉瑕疵检测调试工程师,3496532843,2024-05-13 04:32:33,0,2,0,分不分手的我不知道，不过我亲身经历来讲，我本来也是胖猫似的人物，对爱情有无限的憧憬，自己吃个三五块钱零食都嫌贵，但是给女生买东西咔咔花钱后边我才发现，这就是感动自己罢了好男人不是没了，他们心基本都死了罢了钱是给女人看的，不是给女人花的
654972428,103,mkv 009,未知,37,https://www.zhihu.com/people/mkv-009,,3496279365,2024-05-13 01:23:04,0,1,0,很明显，另一场狼人杀里面已经明摆了有这样的一场残酷事实恋人是一狼一平民（拿到相关利益的一方是狼，另一方是平民）的格式即便恋人留下来就可以获胜（好好生活）但狼人还是会杀平民因为狼人只想要杀人的权力（拿走对方所有的财产），不想费劲和另一个人走到最后而有些人，很明显就是那个狼人
654972428,103,葬天帝,女,7,https://www.zhihu.com/people/44-80-15-30-35,,3495650772,2024-05-12 05:19:34,0,2,0,我和我女朋友都意见一致，看不起舔gou行为。其次就是对点外卖祭拜+外卖发空包等一系列事件感到魔幻。这件事总之就像水浒传好就好在投降，让我们看到投降者的下场一样。
654972428,103,李不胖,女,2,https://www.zhihu.com/people/98-16-63-82,,3494948508,2024-05-11 10:38:31,0,3,0,之前网上一直说舔狗没好下场吗？这不是应验了吗？ 我觉得应该嘲讽才有教育意义啊！ 舔狗成嘲笑对象自然就没什么人去当了！胖猫要是没死躺进ICU估计这会开心死了，他的爱得到这么多共鸣，多么真诚！！！
654972428,103,胡萝卜有毒,女,0,https://www.zhihu.com/people/caicai-82-83,,3494638649,2024-05-11 06:00:43,2,2,0,……恕我直言，事实上，那些分手的情侣，胖猫事件不出，他们也不一定能走到最后……我身边有对象的朋友，人家都甜蜜着呢～
654972428,103,不似少年游,女,1,https://www.zhihu.com/people/8-88-91-54,,3494486189,2024-05-12 04:13:05,0,2,0,哈克:有的人一死，比他一生做的贡献都还大。
654972428,104,我是一个DJ,未知,68,https://www.zhihu.com/people/fu-lan-san-se-bei,无,3494441207,2024-05-11 03:23:46,0,2,0,好事：中国人觉醒了，坏事：只有某个性别觉醒了。
654972428,104,毛毛,未知,3,https://www.zhihu.com/people/mao-mao-71-9-19,,3494411300,2024-05-11 02:37:39,0,2,0,搞不懂啊，为什么没有人同情赌徒，却那么多人同情胖猫。为什么没有人骂赌场，却那么多人骂tz，这不都一回事吗。愿赌服输。我的观点是，赌徒和胖猫都不值得同情，赌场和tz都该骂。
654972428,104,放下不容易,男,23,https://www.zhihu.com/people/bb-92-41,关注不过20人,3494291400,2024-05-11 05:38:57,2,2,0,这种法律，这种执行，是要亡国灭种啊，到时候杀戮到来的时候，不要人人高喊“我是无辜的”，不论哪个组织都不是无辜的，无论哪个人。————这种脱离的现实的歪风，是资本家联合部分女性卖国贼搞出来的。受害者是整个民族，整个国家，是男男女女的普通老百姓。你知道你的敌人是谁不？你知道受害者是谁不？国家和民族的利益重要不，普通人的利益重要不？
654972428,104,二月不吃鱼,女,20,https://www.zhihu.com/people/qcx-53-63,有点多愁善感，喜欢看小说，喜欢美食,3494264627,2024-05-10 18:32:42,0,1,0,因为你不知道自己掏心掏肺，真心对待的是人还是鬼。胖猫事件令很多人愤愤不平，对男孩的惋惜，对女方的痛恨，但我们更应该明白，是什么导致悲剧的发生。男孩的纯情善良，女方的老辣圆滑，在爱情中的地位不对等，一切的一切预示着最终只能结出苦果。爱一个人没有错，前提是你要足够了解对方，并理智对待这段感情。愿所有的情侣都能真心实意、坦诚相待。
654972428,104,邱缠,未知,34,https://www.zhihu.com/people/qing990837,,3494162912,2024-05-10 16:30:10,0,2,0,"做为一个主动给丑女,不会主动给美女的十块腹肌男,完美避过各种坑.[仰天大笑]"
654972428,105,岂曰无名与子同行,男,352,https://www.zhihu.com/people/qi-yue-wu-ming-yu-zi-tong-xing,大号在小黑屋儿里 正蹲在地上画圈圈儿呢,3493926752,2024-05-10 16:26:50,0,2,0,《三体》“物理学不存在了......”《胖猫谭竹》“爱情不存在了......”
654972428,105,大黄,未知,1,https://www.zhihu.com/people/da-huang-51-25,,3493912717,2024-05-10 11:50:18,0,2,0,你有数据统计说明你的论点吗？胖猫事件前和事件后的分手率统计图？
654972428,105,as蓝月儿,男,2844,https://www.zhihu.com/people/aslan-yue-er,反对限制未成年人网游,3493902008,2024-05-10 11:41:42,0,3,0,不存在的，明显是夸大了网络事件的影响力。就胖猫这个热度，全中国14E人，知道的也就1000W级别
654972428,105,陈渝洛雁,女,5,https://www.zhihu.com/people/ye-hang-chuan-9,学生,3493594824,2024-05-10 07:11:31,0,3,0,我身边的情侣都没有受到影响。受到影响的要反思一下，是年纪太小了，还是脑子有病了。
654972428,105,雪语,未知,3945,https://www.zhihu.com/people/xue-yu-12-91,,3493485615,2024-05-10 05:48:15,0,2,0,人生很美好，没有什么必要一定要在一颗吸血树上吊死。
