问题id,页码,答主昵称,答主性别,答主粉丝数,答主主页,答主签名,回答id,回答时间,评论数,点赞数,喜欢数,回答内容
654972428,59,月下归人,未知,114,https://www.zhihu.com/people/yue-xia-gui-ren-53,,3496996571,2024-05-13 11:02:09,0,2,1,说明了很多情侣本身感情就经不起啥考验，或者说很多人突然意识到了自己就是个ATM提款机
654972428,60,反正说不过你禁言,男,776,https://www.zhihu.com/people/zhi-bu-guo-guo-ke,怕别人戳破自己逻辑的人才会禁言,3492675988,2024-05-09 10:30:24,0,1,0,能被这种破事影响分手结局注定是分手也算是一件无心插柳柳成荫的好事
654972428,60,普通人,男,35,https://www.zhihu.com/people/pu-tong-ren-75,没文化，胡写，禁7后是几天,3494519567,2024-05-11 04:33:08,0,2,0,十个救火的少年十减一得九九减一得八八减一得七自杀不可行，便宜了他人，胖猫却应该，尸底垫个人。
654972428,60,肃穆,未知,32,https://www.zhihu.com/people/su-mu-21-3-32,,3494576091,2024-05-11 05:16:13,0,11,0,为什么郭敬明能成功，因为别人是有预见性的小时代的含金量还在不断上升顾理名言：没有物质爱情是一盘散沙，风一吹，就散了！正面反面都对呀哈哈
654972428,60,Mr.杠杠,未知,237,https://www.zhihu.com/people/88aa-77,给我一个观点，我们抬上一天。你获得了打脸，我打发了时间。,3492187383,2024-05-09 03:42:47,0,7,0,2年见两次面给了51万，杀猪盘也不过如此了。
654972428,60,karat1984,未知,159,https://www.zhihu.com/people/karat1984,文学,3492660385,2024-05-09 10:20:18,0,6,0,其实真不是我们男的精阿全情付出，你至少得是对标对方也是深情投入阿。总不能我跟妹妹玩真心，妹妹跟我耍心眼子。这种不平等且被羞辱得感觉，我相信是个男人一般都忍受不了。女生还是不够了解男人，男人得一些底线是不能破的，破了，那就不是男人了。比如：被说穷逼，被带绿帽，被说不行，被说细狗等等。。。一谈及类似话题，男性多数是直接破防拿拳头回答问题了。所以阿，如果说，女方真的，我是说她们家真的：父母重病/弟弟车祸/大哥娶不到老婆/自己生恶疾/家塌了/父母兄弟反正除了她之外统统车祸等，诸如此类的。我想，我们这些做男朋友的，在条件允许的情况下，一定是会尽力出钱出力的。但是你不能骗我，你说你爹死了，他就必须真的死了。即便上午还在下地干活呢，下午也必须雷劈死。你说你妈改嫁了，她都必须改嫁，不但我要参加她的二婚婚礼，连洞房我都得搂一眼，看有没有放进去。你说你弟弟哥哥的出了车祸瘫痪了，那没问题，只要他真半身瘫痪，我拿冲击钻钻下身他都没反应的，钱我出。你说你家塌了，可以，告诉我地址我去看看。没事儿，我联系拆迁队。你说你今天大姨妈来了？！你最好是真来了，否则我几蹬子下去我怕他两捆卫生巾止不住。。。。钱嘛。。。身外之物，怎么花都是花，只要不被骗，谁骗我我就干谁。。。我才不会像肥猫一样那么优柔寡断最后把自己寡断死了。骗我超过2000的，你一顿打跑不了。
654972428,61,溪溪,未知,56,https://www.zhihu.com/people/xi-xi-1-27-56,,3487671581,2024-05-04 21:25:17,68,56,0,选人有问题，还是自己的问题，普通的女孩子不香吗，非要找校花，校花是你可以驾驭的吗，人家要找的是刘强东……和思葱，没那金刚钻儿 咱也不揽那磁器活，非要摘下，你不受伤谁受伤
654972428,61,观澜,未知,338,https://www.zhihu.com/people/guan-lan-60-54,陌上花开，可缓缓归矣,3492734228,2024-05-09 11:17:27,0,0,0,有些人不止要钱，还要命啊
654972428,61,若梦浮生丶,男,1023,https://www.zhihu.com/people/mian-yang-4-2,千萬不要忘記階級鬥爭！,3491117256,2024-05-08 04:53:23,0,6,1,因为，有的人是心甘情愿当M的有的人是被逼无奈的。但是 大部分人真的和胖猫一样，相信自己的女票是个白月光。。所以很多清醒的人已经清醒了
654972428,61,五虎上酱之觉醒姐,男,841,https://www.zhihu.com/people/wrangler-20,勿以小赢而不麻,3494297257,2024-05-10 19:16:35,0,2,0,胖猫这还只是单相思，恋爱都没开始，就送一大堆RMB，结果什么也没有，最后就这样草草结束了自己的一生。大家扪心自问一下：恋爱期间，你的赚钱能力有胖猫厉害吗？两年能50个W吗？如果谈婚论嫁，给得起彩礼吗？不结婚了/离婚了，彩礼不退/只退一部分，你能接受这么大的亏损吗？分手吧，早点结束也是明智之举！
654972428,61,木芝卡芘,男,206,https://www.zhihu.com/people/ao-chuan-pu,巫师，占卜师，psychologist-taoist,3496846944,2024-05-14 06:12:23,0,2,0,这就是随便谈恋爱，随便结婚的代价，因为你对谈恋爱这件事上不够认真，择偶标准太低，所以你就会谈到垃圾，因为你急着交配，急着传宗接代啊，就因为你急，所以你谈到捞女太正常了完全就没有个考察期，纯属小头带大头，小头爸爸，大头儿子，纯粹酒肉情侣，随便谈恋爱，男的为了性，女的为了钱和陪伴，一出这种事情，两个人不分才怪当你是一个自爱且要求很高的人，只要你不急交配，不急恋爱，不急结婚，不急传宗接代那么你很难谈到捞女，因为你看不上捞女，捞女见你那么难搞，也会很快就会放弃你，唯一的代价就是恋爱谈的很少，甚至始终都是单身你要求太高了，没人入得了你的眼，我就是这种人，大多数女生我都看不上，捞女这玩意我更看不上，这种女生刚开始聊天，我就能看出对方人品咋样所以自然而然的就避开了很多烂桃花，恋爱自然也谈的很少，因为看不上所以那些看了《消失的你》和胖猫事件分手的情侣，大多数都是酒肉情侣，你但凡对恋爱这件事情上点心，不要那么随便，你都不会谈到这种因某某件事情而分手的人就是因为你随便谈恋爱，就想着交配或者想着有人陪伴，所以你就会谈到烂人，因为你择偶标准太低了，你对恋爱这件事情太随便了，这是你自己选择的了，就算谈到捞女，谈到女拳也是你自己选的你以为你遇到坏事，遇到女拳都是因为别人，或者因为社会，实则是因为你自己，你自己对恋爱就不认真，那么随便，不遇到s13才怪，你但凡大头带小头，你都不会遇到捞女说白了就是意识层面的原因，归根结底还是那句话，你不自爱，你标准太低，你对恋爱态度不够认真我暧昧期一半都是半年左右，很少女生顶得住我这半年的暧昧期，况且没暧昧之前我还得看看这个女生对我是否是真心，总之我会一段很长的观察期，等我觉得她可以了，我才会和她在一起所以我没谈过捞女，即使是我年少无知时也没有跟捞女谈过恋爱
654972428,62,初禅,男,10593,https://www.zhihu.com/people/snldy-38,我没想着让你一定要认同我的想法，希望你也是。,3494056045,2024-05-10 14:08:11,2,9,0,胖猫的事件之后，有些小脑发育不全的人就开始在社交平台上玩一些你连20块买杯奶茶都没有的梗了还有一些梗图，也不知道是不是真的。女的问男的要20买杯奶茶，男的给他一通思想教育就如果是真的，那算是相当的魔幻了首先我们要坚定捞女还是很简单的就是看她是不是只会一味的索取就好了当然，这也得分人，你兜里就那几块钱叮当响的，你基本上也碰不到捞女，人捞你那点钱还要跟你拉扯，不如大晚上的穿的少一点去夜场钓凯子来的快都别激动，我说的就是这么直接，女的有乱玩的公交车捞女，男的也有朴断掉的种马海王，正经人不会看我这个破防的。女生喜欢说情绪价值，男生那里其实也有类似的东西，我们姑且称这玩意儿叫性价比吧对于能掏得出来的钱的哥们而言，怎么判断对方捞不捞呢？就看是不是一味的索取你钱花了，你总得图点啥吧？图礼拜天昏暗的小房间？还是图吃饭出门玩有个不用负责任的搭子？还是真心实意奔着结婚搞对象去的好人？人一点反馈都没有，这就是捞女啊什么谈个对象不给你挂朋友圈的，除了转账截图其余一概不发的，诸如此类的真想跟你好好过的人真不会这样的玩玩的话那就简单了，钱也花了，事也得办吧？你说要等等没做好心理准备？刚才买黄金的时候我看你也没有啥没做好准备的感觉吧做人就应该实在一点，搞对象的就该好好搞对象，出来卖的就别装矜持胖猫为啥说他惨呢？钱都花了，我估计他都没进去过吧他是希望能跟这女的好好在一起有个未来，但可惜莫得。那么我们从卖肉的角度上来讲，51万，哪怕按1万一次的18线野模的收费来看，也应该收获51次服务吧所以他这个钱花了，用我家乡话来说就是扔水里泡都钓不到。但这也不能判断说这女的捞再来看看你不给她钱，她会不会PUA你，呐呐呐，这一条就中了，结合上面的信息，这是个捞女要得出这样的结论，需要参照很多因素的而现实生活中呢？有些相亲党碰到出来几次吃饭不跟你牵手的，就管人叫捞女这是不对的我真觉得该给捞女定一个硬性的指标，没达到多少金额的真不能算现实生活中有很多人，或者说绝大多数人都是抱着凑合过日子的心态来的。遇到相亲的时候一般也是骑驴找马的心态真就说穿了就这么点破事而已，有人说这世界上没有爱情，那只是你身为普罗大众没有办法去经历而已。相亲遇到骑驴找马的那就不要太正常了人愿意跟你出来，就说明你在她相亲的这么多人里没被筛选掉。人没跟你在一起只是说明你还没有达标也就是她或许遇到过条件好，但是令她更厌恶的，所以保留了你的席位。要么就是她幻想她能够接触到条件更好的，不着急下结论真就这么点事别瞎猜，还有，吃几顿饭收个百来块的礼物真不能叫捞。几百块都要去捞，那捞女的门槛太低了她们都是不用上班，每天睡醒了去洗个头发，化好妆自然有人开车带她们吃饭带她们去玩的。她们不需要收入因为不需要自个儿花钱，一个月混的好混几个包啥的都挺正常的你要是看到一个女的符合我说的这些，就不上班每天活在夜里的，然后天天穿个假的香奈儿啥的拖鞋。那就是捞女的预备军回到这个问题上来，为什么很多情侣会分手因为很多男的错误的评估了他们的感情，他们认为这些事情是能当作聊天的话题的，但其实女生内心却是敏感，会对号入座的。感情没到位，她就会觉得你是不是在阴阳怪气点什么而有些男的确实属于愤青的那种，总喜欢教育对方，试图让对方学会点什么这一来二去的，女生就觉得对方是真的有病，就分开了花你几个钱你还真把自己当啥了对于那些小愤青，会觉得“你看吧，日久见人心啊，她破防了，她是个捞女”就是哥们戏不要太多，正常人几乎碰不到捞女捞女压根不跟赚工资的人玩的再说直白点，她们天天玩的开销不是你月收入还在千这个级别的人能供得起的你也看到了，胖猫也是普通人，所以他拼了命拿命换钱，才勉强供着一个捞女。这点事情没必要说破，说破大家心里都不是滋味总之你记住了，正常人都很安全。特别是收入还不足以让你天天去水疗搓小头的人你知道我遇到过的都是啥样的吗，跟我搞暧昧，我飞过去找她，说饿了，带我去新荣记的火锅，一顿能吃好几千的那种。对她们来说没概念的。在这里也给男同胞们一个建议，如果你跟你的女朋友在花钱买东西的事情上有过那么一些遗憾，类似于她想要啥你买不起。然后完了她现在还跟你在一起那么社会上发生一些男女感情纠纷的事情，特别是涉及到钱的时候，你最好装死。
654972428,62,白衣,男,14,https://www.zhihu.com/people/bai-yi-96-97-50,WUYE,3494209788,2024-05-10 17:28:12,0,10,0,现在我只希望这件事越大越好，最好是TZ和胖猫姐和解，俩人一起带货这样也就是说，没受到惩罚，最后的结果相当于是说， 男性在两性关系中没有任何依靠，没有任何法绿的保障，自己是自己的责任人，自己要随时警醒！看紧自己的钱袋子吧，兄弟们！
654972428,62,军师中郎将,男,148,https://www.zhihu.com/people/k4jkug,00后男生  平权主义者,3489293266,2024-05-06 11:57:11,0,5,0,这个问题下面各位国女对于胖猫事件的评价看法和态度岂不就是最好的例子？可能是因为国女们真情流露的哀悼反而让男生们害怕了简单举几个典型例子：“太遗憾了，这么能挣钱又舍得花钱的男生怎么没让我遇到？”“如果我是他女朋友，绝不会坐视他跳江”“那些不同情他的男的，你们有什么资格？你们有两年赚五十一万的能力吗？”有女的可能不明白：这有什么可怕的，有什么不对吗？这不是证明我们女的比男的有同情心吗？呵想不明白就别想了，洗洗睡吧。
654972428,62,林北山村佬,未知,267,https://www.zhihu.com/people/lin-bei-shan-cun-lao,,3496558989,2024-05-13 04:51:00,0,10,0,2/4.8=0.416666666666在中国你结婚了有41.67%的概率要离婚这还是有离婚冷静期的制约下
654972428,62,ARnego,男,1513,https://www.zhihu.com/people/arnego,养了两只猫，一只叫满仓，一只叫杠杆。,3491957514,2024-05-08 18:03:43,0,19,1,"这个事情吧就像行情一样,趋势确立了,突破只是等一个借口没有这个借口,就等下一个借口呗."
654972428,63,WuwenXidong,未知,11,https://www.zhihu.com/people/mis-w-42,原来神仙鱼横渡大海会断魂,3494894589,2024-05-11 10:21:34,2,10,1,胖猫事件为什么这么火？1.社会中的部分男性从故事中找到自身的影子：高付出，低自尊，低回报。产生心理共鸣。 在恋爱与相亲中追求的主动者一般是男性，而处于被动的一方当然掌握着更多的话语权。“得不到的永远在骚动，被偏爱的都有恃无恐”-《红玫瑰》 前一句是主动方的心理活动，后一句则是被动方。2.触碰了某些群体的利益，使这件事升级为一场舆论战。童锦程与胖猫的高流量，窥探出现社会男性新的情绪需求：反舔狗式觉醒的快感。 正因为部分群体在网络上听信了某些鸡汤：有钱就不缺女人。随后努力赚钱，自我感动地付出。当一个人体验过这种努力投入却没有期望的回报时，ta 的心理就会发生一些变化。例如对异性的需求减弱（因失败创伤认为失败的可能性大以至于不再像以往那般有动力），因得不到所以贬低异性来缓解自我的焦虑情绪，对下一任投入更少的感情与物质等。“选择大于努力”从来不只局限于事业。可以看出当你对一个试图用金钱得到爱情却失败的男人说：钱是给女人看的不是给女人花的。 就像闺蜜对一个刚分手的女人说：他一点都不好。都是一类“情绪价值”的提供。可以看到未来这种舆论战会越来越剧烈，因为它的流量价值在此时已经显现了出来，自媒体在为女性写爽文的同时也会为男性写爽文。胖猫事件不是开始也不会是结束。最后，我预测“胖猫”会像“吴彦祖”一样被玩梗成为一个名词与形容词，相比于“舔狗”，直接使用“胖猫”更有教育价值。
654972428,63,迟韶,未知,102,https://www.zhihu.com/people/chi-shao-50,逆水行舟的研发员,3491096316,2024-05-08 04:36:48,0,6,0,爱人，先爱己！吾生有三大准则之一：不自杀。
654972428,63,Venom Snake,男,9618,https://www.zhihu.com/people/doom-donkey,脑中有科学，心中有道义。,3493063371,2024-05-09 17:17:26,0,0,0,主角在演戏时，遇到和自己配戏的临时演员老是和自己不在同一频道时，解决办法有两个：重写剧本，或者换个演员。通常情况下，都是选择换演员，因为这样沉没成本最低。情侣也是这样。
654972428,63,乖乖七七,男,632,https://www.zhihu.com/people/drnu-zi-lolju-le-bu,电竞相关/电脑硬件/大学相关工作,3495571194,2024-05-12 03:32:20,6,17,0,我猜肥猫没看过金庸，但凡看过倚天屠龙记就应该记得殷素素说的，越是漂亮的女人越会骗人。 
654972428,63,BIU,未知,4103,https://www.zhihu.com/people/biu-74-50,,3494387691,2024-05-11 01:41:06,0,0,0,你说这话有数据调查吗？分手的恐怕是一些类似于车先生这种ATM吧，那分手是最好的选择。
654972428,64,无闻,男,1627,https://www.zhihu.com/people/wu-wen-51-72,IT,3494378142,2024-05-11 01:01:11,0,1,0,你没发现，现在男女对立很严重了么？这是经济下行的必经之路，小日本当初也经历过。在经济繁荣时期，男的乐意多花点钱供养女性，毕竟能花钱比花心思方便多了经济下行期间，男的供养不了，那么男女之间的对立和矛盾就出来了恋爱脑犯了，就去洗脚，洗脚洗多了。就对女生祛媚了。这世上哪有什么女神值得你花钱啊。都是自己辛苦打工赚的，对自己好点。比送给女的强。听哥一句劝。当然，除非你们恋爱了。可以给女生花钱，接触期间，能不花钱就不花钱。
654972428,64,一曲醉笙箫,男,995,https://www.zhihu.com/people/yi-qu-zui-sheng-xiao,我辈无名,3497056041,2024-05-13 11:49:43,0,2,0,因为很多人看清了呗。很多人是恋爱脑，但是不是傻子这盆水正好叫清醒了“热恋”中的他。以上
654972428,64,别回我评论,未知,14,https://www.zhihu.com/people/123456-70-4-65,我也太啰嗦了吧！所以不回我评论是对的，不然我话密到你崩溃,3494490699,2024-05-11 04:10:31,0,6,0,我的评价是跟看了 消失的她 后分手的一样，莫名其妙，举止奇怪，思想不成熟，身体没发育完全。还有，因为别人的事情，乱发挥的人真的……分了更好。这事儿比秦桧的莫须有，还扯淡
654972428,64,JfengzZ,未知,848,https://www.zhihu.com/people/jfengzz,我吃亏的原因之一 “不愿意把人想的太坏”,3491974343,2024-05-08 18:22:59,1,7,1,对于我们特别喜欢，一发不可收拾心动的人，真的可以不计得失的先吸引、先付出，付出了，再观察对方对你的态度: 如果对方很感动，珍惜你的付出，并且加倍的对你好，那么恭喜你，你找到了对的人。如果对方不爱你，但他是个善良的人，那么，他不会欠你的情债，会尽快跟你说清楚，如果你有金钱付出，他会回赠你更大的礼物。如果对方是个渣，那么，他会觉得你是个会倒贴又好骗的女生，会心安理得的享受你的付出，并且还会pua你，让你认为这些都是本就应该的……到这个时候，你对他的“滤镜”也该碎了吧
654972428,64,谢羽军,未知,349,https://www.zhihu.com/people/xie-yu-jun-26-99,真实即真理,3496880491,2024-05-13 09:19:33,0,7,1,因为恐惧和不安全感，社会的法律和一些事件让女男之间信任下降了一大截。因为信任是无法被证实的，这种虚无缥缈的东西一旦被怀疑就直接烟消云散了。就和黑暗森林法则一样，你永远无法证明对方对你来说是永远安全的，最好并且唯一的策略就是不进入森林来保障自身的安全。
654972428,65,零食不过夜,女,526,https://www.zhihu.com/people/ling-shi-bu-guo-ye-32,我就是见不得任何一位零食宝宝大半夜孤零零地呆在我家～,3491598517,2024-05-08 11:27:49,0,2,0,只能说明这些情侣走到一起的维系毫无感情，只有金钱来往。这怎么能算情侣呢，狗头.jpg 正常情侣之间，因为喜欢而在一起的，怎么会因为别人的个例就选择分手，这叫情侣么，陌生人打游戏组队的感情都没这么脆弱吧。所以，麻烦有些关系不怎么熟的男男女女不要再假扮情侣了，大大方方的承认你们是供养者和被供养者，ATM和取钱者，牧羊犬和牧羊人巴拉巴拉巴拉巴拉之类的关系吧。这没什么大不了的，没必要掺和人家情侣间的感情游戏，这个草台班子不需要所有的人都是纯爱战士。纯爱战士play的一环也不需要你们去添砖加瓦，你们两个，哦，不，你们仨，不对，你们肆，害，你们一群……把日子过好，比什么都重要！无论是男还是女，没有必要在一段感情中过于卑微，如果在外人眼里，对方强于你过多，最后还能和你在一起，只能说明你有可取之处，有他看中的优点，不然他或者她为什么偏偏找你。（咦，我这段发言怎么怪怪的）同理，也没有必要仗着别人对自己的喜欢一昧要求对方无条件牺牲付出，牺牲多了总会心理失衡，时间久了，终将酿出恶果。老实人发起火来更可怕的道理大家平常都懂啊，怎么一放到爱情三十六计里就迷茫了……我以前认识一个妹子，经常跟我们说自己是如何拿捏男友，各种无理要求都能被满足。当时还不流行pua这个词，但我总感觉他俩的关系有点不对劲，嘴快头铁的我还是选择了跟妹子说：这样不太好吧，万一哪天你俩分手了，你这男友不得反噬你啊。妹子当时浅浅微笑，给了我一个：你不懂姐的魅力 的眼神，我的确不懂啊！！！后来有一天，妹子男友闹到公司了，还把妹子给打了。我第一次知道原来拳头打在脸上是真的有砰的一声，之前一直以为电影里是后配的音效呢……后来，后来妹子就离职了……
654972428,65,斑大人,未知,1,https://www.zhihu.com/people/ban-da-ren-37,,3495043763,2024-05-11 11:59:51,0,3,0,男人们呀，别让自己处于一种缺爱的状态，吸引正常女性
654972428,65,文人墨客,男,699,https://www.zhihu.com/people/78-93-58-23-32,凭借经验帮助更多年轻人走过职场和情感困惑！,3491115965,2024-05-08 04:52:23,0,6,0,因为舔狗的下场能看出太多虚假的情侣，很多舔狗都有个错误的幻想，那就是只要我努力了，只要我诚恳了，女孩一定会被我感动！然后幸福的和我生活在一起！那都是电视剧毒害我们的男同胞的，真实情况是很多舔狗都扮演者提款机的角色！女神一单厌倦了，自己像个垃圾一样被丢掉
654972428,65,楠木三叔,男,126,https://www.zhihu.com/people/5-14-7-33-13,公众号『楠木三叔』,3494247694,2024-05-10 18:11:59,0,4,0,在这个被网络和现实纠缠不清的世界里，胖猫的故事像一颗石子投入了湖心，激起了一圈又一圈的涟漪。那些情侣们，或许原本就坐在一艘破船上，胖猫的事，不过是一阵风，让他们看清楚了船下的暗礁和波涛。胖猫，一个在虚拟世界里威风八面的代练，却在现实世界里输得一败涂地。他的故事，像一面镜子，映照出了许多人心底的恐惧和不安。那些情侣们，也许在胖猫的身上看到了自己的影子，那些付出得不到回报的辛酸，那些被现实无情打击的梦想。他们分手，可能是因为终于明白，爱情不是游戏里的升级打怪，不是一个人单方面的付出就能换来两个人的幸福。他们分手，可能是因为害怕自己成为下一个胖猫，害怕自己的爱情故事也以悲剧收场。王朔曾说，“爱情就像是一场高烧，烧傻了的人才会相信天长地久。”胖猫事件一出，很多情侣都分手了，可能是因为他们的高烧退了，开始用清醒的眼光看待爱情，看待生活。他们发现，原来，爱情并不是一切，生活的残酷远比他们想象的要多得多。在这个现实比小说还要荒诞的时代，胖猫的故事，不过是一个注脚，一个提醒。提醒人们，爱情很美好，但也很脆弱，需要双方共同的呵护和理解。提醒人们，不要等到失去了，才懂得珍惜。所以，那些分手的情侣们，也许并不是不爱了，而是他们开始重新思考，什么才是真正的爱情，什么才是他们真正想要的生活。胖猫的故事，虽然悲伤，但也给了他们一个重新审视自己爱情的机会。
654972428,65,纳兰迦不爱做数学,女,378,https://www.zhihu.com/people/li-wei-yu-8-7,一只超级懒的女大学僧。,3497938486,2024-05-14 07:58:03,0,3,0,之前《消失的她》上映也有一大堆情侣分手嘛说实话因为这种原因分手的其实也谈不上多爱对方，分手只是时间早晚问题但是通过这件事发现对方是捞男捞女的赶紧分手那就另说，也算是起到很大的教育意义了。希望大家这辈子都不要遇到捞男捞女。
