问题id,页码,答主昵称,答主性别,答主粉丝数,答主主页,答主签名,回答id,回答时间,评论数,点赞数,喜欢数,回答内容
319090387,55,Bramhs.Han,男,84,https://www.zhihu.com/people/youtoulaokele,怕什么真理无穷，进一寸有一寸的欢喜。,1311709194,2020-06-30 18:13:03,0,3,0,我们的征途应该是星辰大海，而不是这些狗屁倒灶的东西
319090387,56,话糙理不糙,未知,26,https://www.zhihu.com/people/qian-feng-47-79,揭示人理 就要敢于去怼：“你虽言之凿凿，可你还是人么你！”,3240578248,2023-10-08 04:51:52,0,2,3,泻药。答案非常肯定，绝对不可能。我只说现实。这十几年恐怕已经验证过了。况且大众能不能广泛接受自己？恐怕大众连自己的某些种种都接受不了吧，不止是这种文化的传播和接受问题，而是这本来就是小众的，如果你抱有太大希望，那么小众的可以成为艺术品被大众欣赏，但更多的却是在暗无天日的角落籍籍无名。况且，大众有的玩起来比谁都花，那也便成了小众不被接受呀。再来说这在国内的发展。西方宗教本来就很敌视同，我国正好在一几年经济起飞，外来这些夹杂着利益的亚文化不断渗透进来，所以同志骄傲节必然被取缔了，大都市飞一般开业的同酒吧文化不断倒闭，软件不断转型，最终走向末路，活着的寥寥无几。太年轻，就容易被利用，被洗脑。你自己感受到的体验到的幸福才叫幸福，否则，多长个心眼，那可能不是。我记得那个骄傲节最后一年的标题是什么“心中有什么，手中有利剑 。”东南亚的，香港的，台湾的，西方的，我的天，大都市一时仿佛都是彩虹色。就在同文化在西方被“广泛接纳”，国内聒噪声四起的时候，资本从中不断收割，无知者不断散播“自愿”的毒种，那些以同自居的亚文化创业者不断收割着自己人，圈钱跑路比比皆是，有赚了钱泰国等地置业躲债，一边偶尔又卖弄华丽生活方式，实则趁机进入我国大都市和新兴城市继续发展这种亚文化，他们看似开放，看似为同代言，实则成为了臭名昭著的毒种，他们眼里只有利益，打着同性交友的旗号，全然不会顾得上同这个群体的健康与发展。lgbtq各有不同，为了利益却又被迫结合在一起，这就是这十几年同文化的发展现状，目前，甚至在小破站等依然有过度宣扬同文化“爱情美满”的，口口声声让同睁开眼看看社会，简直还把国人当成未开化的愚昧大众的。同文化太容易被控制，太容易被利用，甚至于，同自己本身有很多也甘愿成为被利用的工具，只为从中谋利。年轻多听多看多感受，少掺和，迟早会看清真相的。一个简单的逻辑: 你们又没有害人，真的那么美好，就不会倒闭，就不会取缔，就不会人人自危，就不会肯定某蓝是yp软件，就不会肯定某咖是包装软件，就不会都不信那些在一起的一对对是多么资本多么美满了呀。如果这些反过来全都变成美好的，你真的确定你能幸福，你能找到真爱？？这些和你的爱情有什么重要的联系？都是凡人，都是普通人，先接受这一点。依然有相信美好的，他们是光，但也要看清他们是不是挥舞着韭菜镰刀的堕天使。活在大众是宿命，自由发展是格局。永远爱你们，但更希望你们理智，清醒，健康。这才是你们真正的光。本就是光，何必守望着彩虹呢？    
319090387,56,匿名用户,男,0,https://www.zhihu.com/people/,,2779924072,2022-11-29 08:14:07,0,2,0,这些lgbt查查基因，如果基因没问题的，说是lgbt都是心理变态。如果基因有问题，那就是先天变异，值得同情。
319090387,56,特布尔·勃,男,39,https://www.zhihu.com/people/wu-ming-shu-81,喜的是楚腰纤细掌中轻 欢的是一片笙歌醉后听,2529214645,2022-06-14 21:09:15,2,2,3,我为什么歧视南酮群体？因为男同普遍性关系混乱，且安全意识薄弱，艾滋病就是男酮带向世界的，面对一个广泛危害过社会的群体，在我的起点认知里是处于负分的。当然，不反对我对以图灵为代表的早期被迫害的，没有危害过社会的男同的同情，也不反对我对一个男酮印象改观的可能性——可惜对于一个起始印象分为负的群体，我应该提不起什么兴趣过度了解。我为什么歧视跨性别者？因为经常有男跨性别者进入女厕所的新闻，我对此感到荒谬和恐惧。我为什么不歧视女酮群体？因为女酮相对低调，而且性关系也比较单纯，伴侣基本都是固定的，也没有广泛向社会传播疾病。所以，你可以看到我对少数群体的态度取决于这个群体是否危害或威胁正常的社会。这个问题还可以类比社会对游戏的态度。05－10年左右，人们普遍对游戏采取歧视态度，因为当时经济不发达，很多家庭没有电脑，当时的游戏比如传奇又成瘾性过高，导致一大群人放弃了工作和学习，前往网吧打游戏，威胁了社会稳定。又有很多个体的案例被报道出来，引发人们的恐慌。现在游戏普遍移动化，买得起电脑的人也多了，很少有人再去抛弃正常的生活去网吧上网了，反而更多人选择利用闲暇进行快餐式娱乐，不会影响社会。所以现在除了某....的一群老zombie们歧视游戏娱乐，社会大众已经接受游戏了。我不反对社会发达以后，把利益的蛋糕分出一部分来，以供一部分人们选择多样特别的人生。但是某些群体如果执意打着自由的旗号，来危害社会，恶心社会，那我也有敌视、歧视乃至反抗之的自由。
319090387,56,洛神劍,未知,116,https://www.zhihu.com/people/luo-shen-jian-9,,2301960989,2022-01-07 15:19:04,1,2,0,你们这个群体不为我们国男，不为我们河南人说话。我们凭什么为你说话?
319090387,56,匿名用户,男,0,https://www.zhihu.com/people/,,1568684730,2020-11-10 15:27:58,0,2,0,什么时候当很多人、很多“少数”，能接受有人能不接受ta、ta们的时候、能不在意是否被认同被针对的时候。那说明，自身已坚韧强大到一定程度。也说明，大家都逐渐达成同等的包容。其实，本无所谓的。
319090387,57,晴川,未知,2,https://www.zhihu.com/people/hua-zi-jun-57-83,觉得我的回答得还行就关注我吧，爱好男，喜笑。,1315437914,2020-07-02 17:09:32,0,2,0,参考美国，他们的思想解放花了将近70年。但现在时代更加进步了，没有当年那么的封建，所以人们的能够接受程度应该会更高。对于LGBT团体的认同以及知识的普及也会更加容易。但是！！！！想要被接受，就要发出自己的声音。对于LGBT的恐惧以及排斥主要来源有一部分人的思想上的抵触，是很难改变的，但随着社会的开放和人们代代的更替，这种现象会变的更加少。还有就是对于LGBT的过于独断的认知，中国政法大学的教授罗翔说：网络喷子的现象主要来源于网民的无知和网络的匿名性质，他们不知道于他们认知所相悖的观点，从而独断而坚决的相信自己知道的，这种现象的本质是格局小，对于世界认知的缺乏。说白了就是学得少看得少，没文化。那其实也适用于LGBT团体，有很大一部分人收到了误导，认为LGBT就是一种病，会带来更多的性病，以及心理疾病。这些误导让他们抵触LGBT是因为他们的无知。不必为这些人辩护一些什么，因为如果一个人在只了解片面的，或者是单方面的夸张的灌输，就开始对于一个团体或者个人或者现象表示极度的不能容忍，他根本不知道要去把事情了解的更加全面，这样跟风，一昧的相信一些片面的文字是无知的表现。现在主流的问题就基本上是这两种：一种是封建的思想，认为男人怎么能和男人在一起呢？男人就应该娶老婆养家生孩子。另外一种就是人们对LGBT团体的了解不够全面。所以！最重要的就是让世界看到自己，发出自己的声音。
319090387,57,匿名用户,男,0,https://www.zhihu.com/people/,,1311659908,2020-06-30 17:48:18,0,2,0,这帮人爱哪凉快哪凉快去，别出来碍我眼，我也就睁只眼闭只眼当没看见了，咱井水不犯河水。但凡这种团体想要出来寻求立法上的保护或者公共的承认，那我可就不依了，逼我承认bt和我是一样的，忍不了。
319090387,57,甬江马奎尔,男,1662,https://www.zhihu.com/people/fei-li-shi-73-6,浙江我们的名字，绿城我们的信仰,1310625099,2020-06-30 07:50:45,11,4,1,不接受的坏处是什么？接受的好处是什么？如果接受这些所谓的团体能够让房价维持在一个大多数人都能接受的水平，能让教育资源获取更加平等，能够让地头蛇势力得到更严厉的清算，能够让劳动者的权益得到更完整的保障，能够让公共交通更加普及，能够提高基层行政水平，能够增加居民可支配收入减少不必要的负债，能够让霉菌退出西太平洋，能够让中国的核武库规模翻倍，能够让黄河变清让沙漠变绿，能够让中国也人人吃得上一美元炸鸡，能够让中国农民的收入向日韩看齐，能够让海外公民的权利和安全得到更好的保障，那我觉得大有支持的必要。可是，支持你说的这些团体，和这些大大的好处，有半张钞票的关系么？没有。我还听说这些所谓的团体倒是和总部设在美国兰利的某个政府部门有说不清道不明的关系呢？和兰利那边有瓜葛的，能有什么好东西？请问，我为什么要支持一个基本没用而且可能会有害的东西？图什么呢？
319090387,57,CitySwan,女,1134,https://www.zhihu.com/people/mu-mu-70-39,"INTJ读书电影绘画美食建筑交流
我的专栏和圈子都在更新哦！",1307652653,2020-06-28 16:15:04,0,2,1,当然会！下面来分析一下原因。说到LGBTQ这个团体，不得不说一下它进入公众视野的时间。“1969年6月28日，在纽约一群男女同性恋者、双性恋者、跨性别者和关切人士在同性恋酒吧“石墙”遭到警方搜索后展开暴动，石墙酒吧坐落于纽约市格林威治村的克里斯多弗街43号。这场暴动和后继的示威抗争行动是现代LGBT权利运动的分水岭，也促使了LGBT自豪游行成为大型的公开活动。”（来自于维基百科）凡事都有一个过程，即便是在自由民主的美国，在60年代的时候LGBTQ群体也像是“秘密组织”一样，自己的性别取向是不被世俗所认可的。被人们当作是异类，不符合宗教的标准，他们活的十分小心翼翼。就像是黑人运动一样，这个群体在1969年开始了反抗。这种反抗让普罗大众看到了作为人的多样性。作为一个自由民主的国家，为什么在性别取向上这么苛刻？这毫无理由。虽然从生物角度上来说繁衍后代是我们的责任，但是作为一个自由的意志，选择什么样的生活方式是人的权利。如果你身边有LGBTQ群体的朋友，有的时候你会发现，他们比“普通人”会更加的敏感，更加的富有同理心，有时候甚至在某方面是个天才。可我们为什么只是用我们的眼光只看到他们在性取向上和我们不一样的一面呢？在中国，很多人说我们比较传统，不太会接受这些“新想法”，其实在中国这样的群体一直都存在，只是一直被压抑，被隐藏，被漠视。随着信息交流水平的不断进步，越来越多的年轻群体敢于向外界承认自己的不一样，他们的父母也在慢慢接受他们的子女性取向的多元化。可能我们现在正处于美国的70年代，随着时代的发展，我们的下一代，正在为了自己的权益做着努力，这种包容的思想会越来越被接受。其实举一个很简单的例子，七八十年代的中国，可能24，25不结婚，祖辈就会觉得年龄太大了，但是现在，30多不结婚的人大有人在，社会也慢慢在接受。所谓的大龄剩女大龄剩男，社会对他们的包容力是在增强的。而这种30多不结婚的现象，在美国十几二十几年前早就是常态，二十四五结婚才是奇怪的事情吧。所以，凡事发展都有一个过程，中国只是慢了一点，但是这个趋势是不会停止的。而且，LGBTQ群体被广泛接受又有什么社会危害性呢？并没有啊，甚至会少很多社会骚动和因为内心缺乏安全感而导致的暴力冲突吧。恰巧今天是六月的最后一个星期日，也是往年美国Pride Month游行的一天（6.14-6.28）。六月被定为美国Pride Month其实时间不长，是2016年奥巴马总统所确定的。今年受到疫情的影响，可能大规模的活动不会进行，但是人们还是在ins等社交媒体上表示对该节日的庆祝。即便不是这个群体的人，我们也应该支持他们，合法化他们的权益。
319090387,57,匿名用户,男,0,https://www.zhihu.com/people/,,1311129978,2020-07-01 03:59:17,0,13,2,作为lgbt，可以。作为lgbt团体，不行。lgbt属于精神疾病，不治你就算好的。
319090387,58,基辅带V,女,110,https://www.zhihu.com/people/v-57-77,,3292443506,2023-11-17 10:04:30,0,2,0,坏的方面是大概率不会。好的方面是劳保群体的多数，也会一日不如一日，因为他们正在自我绝育。所以最好的出路就是学习哈马斯，彻底地拥抱小群体主义，虽然我自己被围剿地很惨，但是你也别想好过
319090387,58,太液清波,男,108,https://www.zhihu.com/people/david-65-81,看风、看水、看山、看海、看人......,3080036630,2023-06-19 02:41:57,0,2,0,什么牛鬼蛇神就要大家广泛接受
319090387,58,无妄之灾,未知,44,https://www.zhihu.com/people/wu-wang-zhi-zai-77,,1311392133,2020-06-30 15:01:49,1,3,0,这就要看LGBT团体与个人有多少山东人的政治智慧，什么是山东人的政治智慧？“杀人放火求招安”。当然，现在是法治社会，可不能真的去杀人放火。想想如何在中国从“统治对象”变成“统战对象”才是最终目的。这就不能“外来的和尚会念经”招办西方那一套了。毕竟连市场经济来中国都要“特色”一下，你LGBT是多大脸就直接生搬硬套？别觉得少数代表就是绣花枕头，就是橱窗里的假人。当人家投票权、提案权是假的吗？打不过就加入他们嘛！要你砸烂旧世界你肯定没那个能耐，单纯考个公务员不简单多了。别整天什么不是“真正的平权”，新中国建国就喊“男女平等”，54年就“男女同工同酬”，到如今离婚冷静期还不是说设就设。可你能因为现如今设立了离婚冷静期就能睁着眼说当今男女平权还不如前朝吗？ 中国LGBT的最终奋斗目标与唯一的目的应该是同性恋婚姻合法化。如果这事能在二十年内做成那就是八辈子烧高香了，之后所有精力都该放在维护胜利成果抵御保守势力反扑上。中国的LGBT串联起来肯定不比小动保人数少多少。沉默的大多数再不满，现在狗都已经开除“六畜”籍了。活用自身优势，照理说竹鼠与三文鱼都是动物，但三文鱼就是比竹鼠要更平等。依照我国某些人的媚外程度，LGBT将婚姻合法化变成“现代人类文明的要求和体现”也是很有可能的。  
319090387,58,丁一帆,男,5316,https://www.zhihu.com/people/ding-yifan-60,C/C++/AMP/opencv/CUDA/ML/tensorflow,1301301056,2020-06-25 03:37:48,2,2,0,先说我个人的态度，les可以其他免谈，mtf的寿命堪忧，gay的艾滋病发病率比异性恋高1-2个数量级，les至少没有负外部性，我认为个人方向比较容易接受的是les但是社会方向估计是更支持gay打压les，gay的社会负外部性较低，而les会降低生育率。而且ngo基本上支持的都是gayles很少。总结一下，gay会处于压制但可发声的阶段，而les则会处于默许但无法发声的阶段。两者对于中国普通居民都太刺激了。mtf这种早就被知乎禁了
319090387,58,繁重的秋春,男,585,https://www.zhihu.com/people/woluguo,,1269449548,2020-06-07 11:07:52,1,2,2,我觉得有必要对这个问题进行回答。我如果不说话，以后没人为我说话了。这个问题，感觉跟宠物狗和吃狗问题，有点类似。舆论的关注点，不在社会民生问题上面，老是被这些鸡毛蒜皮的事情吸引住。有些热爱宠物狗人，不顾法律法规，还去拦截肉狗运输，现在貌似有些地区要出台禁止吃狗肉的法规了。这貌似是一种对普通大众的侵犯。基于这个认知，我罗里吧嗦说了这么多，我有必要问下题主。中国人向来是自扫门前雪不闻天下事。除了你们的父母，没人能够干涉你要跟谁在一起吧？国家法律也没有说禁止这类行为啊。如果有人因此歧视辱骂，那应该报警，每个人的人格都是受法律保护的。但是，要让全中国接受，这个让我很奇怪。到底什么才算是接受？婚姻不是私人问题吗？但是，LGBT的人老是喜欢公开化，真怕天下人不知道他是特殊的。这是何必呢？当少数派也不好吗？达芬奇不公开他的性取向，也不影响他建功立业啊。我不打扰你就行了，你要让我接受，我感觉这我不能忍啊！接受什么？关我p事？现在失业率挺高的，总理都出来说摆摊是一种人间烟火了，不要老是扯这些鸡毛蒜皮的事情。明明就是少数派，硬要让别人去接受，我要怎么接受你啊？我天真就是异性恋啊！
319090387,59,匿名用户,男,0,https://www.zhihu.com/people/,,1211374412,2020-05-22 08:02:03,8,2,0,我不歧视LGBT呀。但LGBT到处刷存在感，逼别人接受他们。真正的lgbt群体才不想被关注性取向呢，你们都是假的，要么就是拿出来显摆。我身边也有LGBT，我本来是不讨厌他们的，但他们非要在我面前故意刷存在感，脏了我尊贵的眼，要是他们一辈子偷偷的不见光我不就不难受了？而且他们本来就违背人类繁衍规律，生不出孩子还当什么人类？我真的不歧视LGBT，我虽然不能理解但我接受。所以我一看见这儿有个标着LGBT四个大字的问题我就要进来喷，让你们都看到我的存在。我真的不歧视啊狗头。不加狗头真就看不出来是友军呗
319090387,59,火山里的冰,未知,0,https://www.zhihu.com/people/huo-shan-li-de-bing,,2771883309,2022-11-23 17:53:57,0,1,0,如果不是世界杯上的幺蛾子，不会注意到这个话题。个人的想法很简单：L也好，G也罢，T也无所谓。只要不把我和我家人当目标就好，平常大家也不会广而告之个人的取向吧啦吧啦吧？但双性恋感觉就有点明目张胆耍流氓了，心理疾病和耍流氓是两个概念。就觉得很奇葩，富裕国家的人已经到了要灭亡的前奏了么？他们不关心穷人们吃不上饭，不关心海平面上升带来的威胁，反而为了各种无谓的东西而义正辞严。就这么继续发展下去，未来会不会出现要求不被歧视的“同时信阳基督佛教伊斯兰等多种宗教群体”、“爱吃血的基督教徒群体”、“吃猪肉的伊斯兰教徒群体”、“爱吃翔群体”、“光屁股扫大街群体”、“多配偶群体”等等各种不正常的群体，并以不能受歧视的名义明目张胆的寻求特权？这都是要疯么？你自己喜欢啥，自己做就好，有必要给自己脑袋上扣个帽子然后说“我是不正常的，你们不能歧视我”，你是太阳啊对别人那么重要？奇了葩了……
319090387,59,墨孜,男,207,https://www.zhihu.com/people/cl-wurz,,2732533753,2022-10-27 08:23:10,3,1,1,在异性恋都还有各种限制，姐弟恋、异地恋、女主外男主内都还没被广泛接受的现在，提LGBT平权，是不是太超前了。
319090387,59,同志你好,未知,5,https://www.zhihu.com/people/ggf-89,勤劳勇敢的中国人,2418972359,2022-04-01 18:02:03,0,1,1,做了这么久疾控的志愿者。看了这么多人。现在我只认为，不妥协持续的抗争，才是实现彩虹见到太阳，唯一的机会和办法。就像美国的黑人运动一样，成为政治正确不可商量的事情。矫枉毕定也必须过正。先让他正确，不敢歧视，努力让歧视者成为舆论谴责的少数，歧视gay就会被认为违法，不能立足，自然有人出来解释合理性。想反你就算再有道理。人家就是不听。一如既往就是来挖苦，讽刺，疏离。就是歧视你，因为他不会有任何损失。更加肆无忌惮欺负你。当做他其他地方失意的撒气桶。谁都可以来笑，这是人性。而不是我们作为gay应该承受的。这是我的一些思考。尽管目前来看，并不明朗。在有生之年要实现合法化，走出去正常的生活。我支持一切对此有利的事情，参与部分。但是绝不把希望放在其他群体身上。至今，很多直男把当做开玩笑互损的谈资。诸如“你才是死gay&#34;或者明支持暗贬“不尊重也不反对”“在小圈子里没事，就不要走出来了”“不要出来会带坏小孩子”“我不歧视，但是你不能是”这些就是歧视或者颜值正义，反而拉低包容度。比如“各类腐女”炒作cp，卖腐，只看颜值。不待见其他的。表面上支持LGBT，实际作用让大众有更大的误解。消费群体，脱离现实，百害无一利。更恐怖的是，Gay歧视自己。自己认为不应该有小孩，会带坏小孩。也不应该出柜，不能在外面牵手，自己觉得丢人现眼。（还是受压迫太久了，不敢接受别人目光。更不会把恶意的目光瞪回去。）不靠抗争，寄希望于“代表”根本不能实现平权运动的彻底胜利。比如，很多gay自己很努力，奋斗多年。事业有成。获得他人认可，后终于有勇气出柜。这当然是理想情况。但是会导致一个结果。你不优秀都不配做gay，你没有钱出什么柜。你不成功，不配获得性取向的尊重和认可。这就是被动的以他人的认可来实现LGBT平权的代价。实际上还是底下的姿态，讨好异性恋，不能平起平坐。高校艾滋教育宣传时，还要刻意强调男同比例高。无端抹黑。就像我对我以前的部分朋友同学出柜的时候，说的，是相当于通知的形式。希望他们不要在我面前说对gay不好的言论。不是希望他们理解，也不希望他们从心里尊重。我的意思是，以后在我面前公然歧视挑衅我。我就会觉得被冒犯，严重了，我就会反击你。并且断绝往来。我没必要与让我不舒服的人当朋友。提醒是必要的。妈的提醒以后还说。就太不懂事了。不求别人理解，是不能控制别人独立的思想。就所有事，不一定等到全部人理解，全部人支持，全部人认可。我们才能活在世上。做事最怕的就是出发点本来就是不合理。让异性恋全部理解同志，本来就不合理，很多工作围绕这个展开，祈求异性恋可怜同性恋，然后支持自己。怎么可能了。浪费精力，还不讨好。只有扩大影响力，然后报团。最后影响社会，制定法律。就像库克是gay，在苹果工作的人就不可能敢歧视。所有歧视gay的人就不能去苹果工作。进而要求上下游企业也不能歧视。最后出资赞助各种社会运动，自媒体。赢得自己的话语权，影响力，也懂得利用势力（台湾回归）。借力打力。让执政者，不可忽视这一股能够团结也可能变成支持对手的力量。它当然选择对自己有利的。从而一切顺利，合法权益。                   西欧，美国，中国台湾LGBT平权运动启示录。
319090387,59,匿名用户,男,0,https://www.zhihu.com/people/,,1991484230,2021-07-11 09:05:54,0,2,4,lgbt在哪国被广泛接受了？比如我一现实中的朋友跟我说他出柜了，我当面肯定表示祝福。但我心里会膈应，会下意识地远离他。你去传说中对同性恋最宽松的欧美发达国家看看，公开场合大家肯定都表示祝福。背地里是怎么看基佬的，你光读那些光伟正的主流新闻观点，你肯定看不到民众的真实想法。
319090387,60,Zoidberg,男,48,https://www.zhihu.com/people/zoidberg-85,,1972312523,2021-07-01 07:38:00,2,1,0,不会！为什么？不是因为观念问题，而是现有的“平权”运动的形式太扯淡。就比如说厕所问题，我可不希望有一天在外面突然肚子痛想上厕所的时候，要先从n个性别厕所中找到那个我可以进的厕所才能解决我的三急问题。此外我断言，就目前的西方各种平权运动的做法来看，不仅无法做到平权，还会加深不同群体之间的仇恨。
