问题id,页码,答主昵称,答主性别,答主粉丝数,答主主页,答主签名,回答id,回答时间,评论数,点赞数,喜欢数,回答内容
319090387,29,莳花,女,91,https://www.zhihu.com/people/jing-wai-shi-li-60-90,我虽然不想死，但却不畏惧死亡。我已走在路上，纵死不悔。,3215961201,2023-09-18 06:19:43,0,1,0,他们连自己都不接受不自爱，何谈接受LGBT？还是看看菲律宾共产党吧…
319090387,29,Macchiato 牛牛,未知,300,https://www.zhihu.com/people/yu-jing-fu-55,牛神大学附属第一医院脑外科主任 老gay格力亚 你尽管逃,3194170608,2023-09-02 14:13:05,0,0,2,我认为知乎部分人已经实现了 可男可女，这是LGBT伟大胜利。
319090387,29,Vince,男,5463,https://www.zhihu.com/people/vincent-99-79-74,Vive la Liberté !,1313932329,2020-07-02 01:19:25,0,0,0,不会。在中国，你作为少数派永远不可能跟多数派平起平坐。
319090387,30,匿名用户,男,0,https://www.zhihu.com/people/,,1313373552,2020-07-01 15:22:01,2,3,0,"把这个问题下的回答翻一下就知道不可能，多少人已经把LGBT群体中的大多数视为反华白左分子了，多少根本不清楚LGBT群体所面对的真实困境的人在那里大放厥词，似乎他们看到的反华人中有一个人是同性恋则大部分同性恋都反华，还有人特意地问JZY是不是同性恋。仅仅因为看到这么几个个例就有很多人不停以“大部分LGBT”“很多LGBT”这样的字眼来描黑整个群体。很多答主说LGBT不要把自己标签化，可是现在是很多人把各种负面标签贴到LGBT身上啊。不要因为自己看到的几个个例，道听途说的一点点传闻就给整个群体贴上标签，我在几个以“大部分”这样的字眼下的回答都有评论，请问数据在哪里，报告在哪里,无人回复。作为一个遵纪守法，踏实学习，只是希望被平等对待的LGBT的一员，很多回答我看的时候心中的感觉只有一个词能形容“触目惊心”。"
319090387,30,眼见你再起高楼,男,178,https://www.zhihu.com/people/yan-jian-ni-zai-qi-gao-lou,,1311093248,2020-06-30 12:02:31,2,3,2,那一天，必须，也必定到来
319090387,30,文斌地,男,3760,https://www.zhihu.com/people/wen-bin-di,,1712471252,2021-02-03 04:42:49,0,0,0,在目前已知的很长一段时间内都会停留在不问不说的方面。
319090387,30,Tyou,男,375,https://www.zhihu.com/people/ken-tyou,乳酸君喝牛奶，人类在后~,1352120492,2020-07-21 12:08:36,0,0,0,诶！为什么话题标签一带上“LGBTQIA“，知乎就把刘看山的自动邀请功能屏蔽了呢？所以说，连知乎这样的地方都不能接受，你说能广泛接受吗？
319090387,30,鲸灵,未知,3404,https://www.zhihu.com/people/5505190song,空气，水，我的思想和文字都是免费的。很荣幸能被你们认可引用,2743102594,2022-11-03 17:08:54,0,11,3,这个问题在中国压根不存在，也永远都不会被讨论。西方任何复杂的问题，到了中国都会变得十分简单。什么东正教，天主教，新教，路德宗、归正宗、安立甘宗、卫斯理宗、公理宗到了中国就是一句话“信耶稣的”。中国的基督徒从来都不会为了争论耶稣母亲是神还是普通人就互相指责对方为异端要烧死对方。只要不影响我赚钱，我管他隔壁的二叔家的三姨夫的二舅家的外孙子的性取向是啥，关我屁事，关大家屁事。这种不影响大家赚钱的事情永远不可能出现在中国的公共议题上。lgbt有人喜欢有人不喜欢，都是个人事务，不妨碍别人生活爱怎么着就怎么着。自由最重要的是能不做不想做的事。一个不许不喜欢lgbt的国家居然自称自由世界的领头羊，魔幻。
319090387,31,胡仙君,男,28780,https://www.zhihu.com/people/hu-xian-jun-80,殖人不会因为生活改善而不恨国，但会因为逼格被压制而闭嘴。,2447445888,2022-04-19 13:36:17,5,10,1,试打一拳：lgbt已经过时了！众所周知世界上不止有两种性别，所以b（双性恋，bisexual）应该改为m（多性恋，multisexual）。从此以后lgbt改为lgmt。
319090387,31,tim 未来之光,未知,1915,https://www.zhihu.com/people/timwei-lai-zhi-guang,放下助人情怀，尊重他人命运。,2334446387,2022-02-04 04:56:33,0,11,3,我支持LGBTQIAHDKWKNENFFJEKMSMD真得，桶蘸价值，就是这样获得的越多越好只要能有桶蘸价值无论是爱狗，吃素，女权，都能搞出桶蘸价值但是二次元却被爆锤，说明顺从的不存在桶蘸价值
319090387,31,Valentine,男,175,https://www.zhihu.com/people/zhter,,1286754008,2020-06-16 17:15:30,0,14,2,gczy都没有被全中国所有人接受，你lgbt有什么理由？
319090387,31,幸福的水獭,未知,402,https://www.zhihu.com/people/shui-ta-94-28,热爱故事的写作爱好者（大概）,1311269031,2020-06-30 13:40:29,10,12,1,以前的：你可以不接受，但不可以歧视现在的：你不接受，就是歧视！
319090387,31,地球众裁官,未知,684,https://www.zhihu.com/people/urdde,我說的都是對的，理解不了自己身上找原因。​,2250500858,2021-12-01 00:24:33,1,11,6,"诚恳地说我个人是非常不认同LGBT这种文化与社会形态的，我不想因为恐惧于国际性的政治正确，像大多数人一样唯唯诺诺地去装什么理中客、扮假中立，或说话自我审查。如果有人要将我这种排斥上升到歧视，那么我想说这仅是你们的个人主观理解，我不认为我的不认同是属于歧视，我认为一个正常的世界不应该将某种思想观念去定义为一种不可质疑的标准答案；它不是一加一等于二的问题！无论是LGBT，还是同性婚姻我个人都不希望能广泛被中国民众去接受。同性婚姻我个人也是100%反对的，但是因为它不是今天要说的主题也就不在这里详谈它了，如果你们有兴趣了解我对同性婚姻的观点及立场建议你可以转去我另一个文章：https://zhuanlan.zhihu.com/p/437814508下面就谈谈我个人为什么不认同LGBT的文化形态最主要的两个观点：观点一：如今的时代下，公开你不认同同性恋及LGBT远远要比公开你是深柜还要更加的艰难！法国大剧作家、启蒙思想家博马舍曾说过：若批评不自由,则赞美无意义。在今天的主流国际社会之下，拥护或默认拥护LGBT几乎成为了世界性的政治正确。如果当下你再去说一些不认同他们的话你会遭遇到一大堆人对你的围攻和冷嘲热讽；他们会为你贴上各种老古董、封建主义、无知愚蠢的思想标签，而这些思想的标签常常都没有任何的科学依据，单纯的只是情绪上的发泄而已。在一些西方的世界里更为荒诞，他们会得到公权力去支持这一种逆向的歧视；如果你是一个企业老板或者HR你拒绝录用一个同性恋的求职者，如果你是一个牧师你拒绝为一对同性恋征婚的请求，那么你随时都会可能面临法律的控告与惩罚！世风日下，例子繁多，荒诞至极。准确地来说，拥护LGBT其实已经远远不止于政治正确了，它已经慢慢开始走向特权、走向逆向歧视，甚至是霸权主义！所以，同性恋是弱势群体云云的这一套说辞放到今天来看它已经是完全的落伍了，如果不是落伍那么就是在自欺欺人。相反，那些不认同他们的群体已经成为了今天的异类，已经成为了今天的弱势群体。观点二：白左——思想观念的激进派，解构人类社会传统价值与伦理道德，给未来人类社会带来更多的不确定性与不稳定性。周所周知，西方白左是整个世界思想观念激进的推动者，他们所推动的法律或主张几乎都是时常充满争议性的，比如LGBT、同性婚姻、女拳、黑命贵、未成年人性行为、毒品合法化、卖淫合法化等等这些背后力量都是来自于白左。如今西方很多国家的校园已经完全将这一套政治正确带进校园里了。幼稚园，小学就开始课本就开始教小朋友们男的可以跟男的结婚、女的可以跟女的结婚，如果你身体是男的但你认为自己是一个女的这是正常的、如果你身体是女的但是你认为自己是一个男这也是正常的，你还可以通过变性手术更改你的性别，还有只要你觉得你认为你是女的你就可以到女的厕所方便.......儿童们的身心、价值观念都还完全的没有成熟就开始教这些，这难道不是灌输洗脑吗？朋友们你们也希望将来你们孩子的课本也是这样吗？思想观念的激进你很难说它是好与不好，因为思想观念不存在一个正确的标准。但是有一点是肯定的，那就是思想激进意味着人类对自身的约束变得越来越小，自我约束能力变弱会给社会传统价值与伦理道德带来更多的破坏性，对未来世界也会带来很多的不确定性与不稳定性！当年当著名同性恋运动领袖施帕尔曼被问及同性婚姻后下一个争取目标时，他明确回答：“争取三个人结婚的可能。”各位，对照上面这个言论大家觉得如果三人婚姻合法再下一合法的目标又是什么呢？交给各位看官自己解读吧。"
319090387,32,花园口火烧连营,男,61,https://www.zhihu.com/people/sun-meng-lei-66,学生,1463159964,2020-09-09 13:52:25,0,0,0,公序良俗原则了解一下？
319090387,32,程思,女,93,https://www.zhihu.com/people/monvhh,OpenMind,3167873457,2023-08-16 07:13:10,3,9,10,不知为何，跟我稳定工作的来访，大都来自LGBTQ群体。我猜测是因为：少数群体的选择很少，他们需要筛选信任的咨询师，不容易。我比较开放和稳定，无论他们抛什么出来，我都很镇定——不是故作镇定，是因为全然不在意。（我反而觉得他们有时候还不够开放，hhh从人本角度讲，不开放都是有原因的，重要的是理解。我也有不开放很固执的部分，也没必要逼自己开放。）我从来不是因为”政治任务“（政治正确）而接纳LGBTQ群体，我的接纳都建立在理解之上——这与人本的态度一致。首先得声明，我此刻写下的理解，不一定正确，更不全面。我对这个群体以及相关知识了解很少，我会保持学习和接受改变。现在，让我们从性别的诸多方面谈起。生理性别性别认同性别表达性取向生理性别：染色体非XX和XY占比1%在《女性主义治疗》课上学到的知识，真是大开眼界。如果XX染色体对应的是女性，XY对应的是男性，其他均不算作男性或女性，那不男不女100人之中就有1个。除此之外，影响生理性别的还有激素、基因表达，等等。过于复杂，我们只需要知道，即使仅从生物学意义上认识性别，它都不是二元的。性别认同、性别表达：如果没有对男/女性的刻板印象和模板，也不用区分什么性别认同/表达性别认同是指，抛开你的生理性别不谈，你更认同男性还是女性的身份。性别表达是，我想表现出来像女性或者男性，比如作为男性我喜欢穿裙子，作为女性。。。我实在想不出有什么。由于女性在性别表达上似乎没什么限制，可以引发对男性限制的质疑。凭什么”正常“男性不能留长发、不能穿裙子、不能过度化妆？没有道理啊？社会普遍接受的”性别表达“，只是经年累月的社会规范而已。而这些社会规范，从来没有保持千年不变。中国女性从束小脚、不能露皮肤到现在无限制，一直在变化。如果没有这些对男性或女性的规范要求、刻板印象，我们也不需要去区分什么符合男性或女性的性别表达。而性别认同，在我看来是内隐的性别表达。我认同自己是坚强强壮的，而不是女性的温柔柔弱，所以我的性别认同是男。可是为什么女性不能坚强，而男性不能柔弱呢？我们普遍感受到，社会在逐渐开放，关于外在和内在的性别边界正在模糊。比如我这一代和我妈那一代女性相比，我们更男性化——如果男性是坚强、理性，女性是柔弱、感性的话。同样，我们这一代男性与我们上一代男性相比，他们似乎更女性化，他们比较敏感和温柔。——如果温柔和敏感代表女性的话。可以想象，在没有男/女性在性格和外在上的社会规范要求的时代，性别认同和性别表达就会失去意义。性取向：先天还是后天的不重要，就像你爱吃咸/甜豆花一样性取向是指你喜欢何种性别的人，对何种性别的人产生性吸引。以前我感觉很乱，比如如果我生理性别女、性别认同是男、性取向是男，那我到底算是同性恋还是异性恋呢？现在对我而言不重要了，如上节，性别认同没有意义。性别认同、性取向 是否受生理因素影响（染色体或者体内激素），抑或仅由社会因素决定——比如生理性别女的小孩，被当做男孩养大，导致性别认同是男性，或者导致受女性吸引。或者生理性别男的小孩，从小家庭环境只有女性，没有与男性产生足够的交互，导致性别认同是女性，或者性取向是男性。很多理论去研究性别认同和性取向是天生决定还是后天产生，精分在这方面颇有建树。很多时候我都会觉得有道理，直到阅读了《肯定性咨询法》——它的理念是：先天或者后天的不重要。我想举一个对我而言贴切的例子：喜欢吃甜豆花或者咸豆花，是先天决定的吗？还是后天影响的？通常来说，南方人喜欢吃甜豆花，北方人喜欢吃咸豆花，这是生理因素决定的吗？还是因为成长环境中只有一个选择，培养出来的习惯？——这一点大家会比较倾向于后天影响吧。但是如果是后天影响的，那为啥接受同样的影响，很多人依然不会改变？如果是先天的，为啥有些人会改变？读到这，大家会不会觉得这有何必要，管他先天和后天，你爱吃啥吃啥。我总觉得，甜/咸豆花和性别认同/性取向是一样的。管他先天和后天，为什么人们不能拥有选择自己性取向的权利，他们并没有伤害任何人，也没有伤害自己。伤害他们的，往往是不接受他们的人。性愉悦：谁说男女搭配才是最好的这个topic真不敢随便写，但对我而言，学心理咨询颠覆了我对这方面的认知，而我觉得很重要。女性的性愉悦跟抽插无关，我了解到的是百分百无关；gang门刺激是有性快感的，我记得有份研究提到百分之五十的人表示有性快感。这些一定程度从生理意义上否认了异性恋的唯一合理性。再多我也不懂了，感兴趣自己研究。Q是人类终极形态：我可以今天吃咸豆花，明天吃甜豆花我理解的Q即性别的流动。以上一切皆可流动——性别认同、性别表达、性取向。流动即没有固定且确定的答案。我可以今天吃咸豆花，明天吃甜豆花。从性别表达和性别认同的角度来看，我们每个人都会有今天想强势一些，明天想慵懒温柔一点的时候。作为一个女性，月经周期对激素的影响，激素对心情、对整个人的影响很强烈，所以一直在经历这样的变化，因此我非常能接受性别的流动。而性愉悦这一点也打破了顺性别异性恋是唯一的观点，性取向就像豆花一样，我为什么不能今天喝甜豆花，明天喝咸豆花呢？或者我一辈子只喝咸豆花？事实上关于咸甜豆花，发现一件有趣的事情：我小时候一直喝甜豆浆和甜豆花，后来在北方生活了一阵儿，喜欢上喝咸豆花，但到现在为止，我还不能接受咸豆浆。有点离题，但总之很多事情从来不固定，有太多种可能。稳定让人安心，但实际没有什么道理。——我们只是太害怕了，害怕不稳定和未知给自己带来伤害。这无可厚非，我们可以在自己的安全基地待着，然后向外探索。在这个过程中，安全基地逐渐变大。跨性别：如果可以随意性别认同、性别表达、性取向，为何还要Trans？前面我已经说明，性别表达和性别认同是扯淡，纯粹是社会文化强行给我们设置模板，不讲道理的规矩，且已经有了不可逆转进步和开放的趋势。在此基础上，为什么一定动刀子转换生理性别，我不是很能理解。以我对女性身体的了解，女性身体之不同于男性的部分，全都是为了生育而存在的。如果不生育，你会发现它们都是负累。子宫带来一月一度的姨妈，就不说有多麻烦了。乳房在运动时都是负担（4月半马跑完我痛了一个月…），即使是最舒服的文胸都没有不穿舒服，还要担心乳腺癌。我作为女性，都不想要。实在想不到有什么必要去做身体上的改造，有害无益。那些改造后的器官，本来也不可能起到相应的作用，只是一个装饰，那不如直接用外在装饰。如果你希望自己看起来像女性，你可以穿女性的服饰，戴假胸。如果你希望自己看起来像男性，也同样。《肯定性咨询法》中也是类似的态度，尽管心理咨询/治疗是以尊重来访为前提的，但当来访提出想通过咨询/治疗转变自己的性向，从同性恋转为异性恋，咨询师可以拒绝。我们可以探索下，为什么你想转变，是谁给你的压力？至于性器官对性吸引的影响，之前读到一个观点：因为隐藏，所以更有性趣。假使我们每天裸奔，人们还会受到性器官的吸引吗？到此，差不多了，有点乱，我也累了。性别议题相当有争议，以上只代表我此刻的想法，无意改变任何人。（保命接受讨论，不接受吵架和攻击。——写于2023.07.21 
319090387,32,匿名用户,男,0,https://www.zhihu.com/people/,,643636203,2019-04-07 06:24:50,42,42,5,这个团体，就算是号称最包容的欧美也没有做到全体社会成员都接受啊，为什么就一定要全中国人民接受呢？凭什么就得全中国人民接受他们，而不是他们接受全中国人民？不反对，就已经是很宽容了。别得寸进尺。
319090387,32,匿名用户,男,0,https://www.zhihu.com/people/,,1311843764,2020-06-30 19:40:45,0,12,0,团体的话不会被广泛接受，因为不会乐见这样的团体存在。LGBT团体的主要特征是：口号理念照抄西方、追求政治权利、容易接受外国的资金、容易聚众。有没有觉得和香港暴徒的特征重合度不小？这些全部踩在敏感线上，加之识别难度太大，实践中被一竿子打死在所难免。真想保护权益，首先要放弃彩虹旗。走有中国国特色的道路。
319090387,32,匿名用户,男,0,https://www.zhihu.com/people/,,1312784568,2020-07-01 09:45:57,0,10,2,作为一个gay，我其实有很多话想说。我可能跟很多同志们的想法不一样。首先，基本上可以断定我们这一代的lgbt都无法实现平权了。纵使lgbt本身没错，只要大部分人接受不了，那么lgbt就上不了台面。很憋屈，但是没办法，世界就是这样。但是，我觉得其实也不必强求什么婚姻合法，现在异性恋都不怎么结婚了，改善大众对这个群体的固有印象才是同志群体最需要做的。现在国内的平权运动其实起不了多大作用。第一是被打压，平权运动只能小范围开展甚至无法开展。第二是方法不对。比如有个活动是同性恋上街求拥抱，我个人觉得这个没有什么意义。反而会让本来就厌恶的人更厌恶同性恋。举个例子，你讨厌不洗澡的人，然后一个不洗澡的人求拥抱，你不抱他就说他被歧视，你心里会怎么想？是不是有点被强迫的感觉？强扭的瓜不甜。（不洗澡是错的，同性恋没错。但是对于恐同的人来说，他们觉得同性恋是错的）第三是时机不对。历史上很多翻天覆地的改变都不是想做就做到的，而是社会问题不断积累，直到出现了某个契机，部分人抓住了这个契机，搞了一些运动改革之类的事，才把当时的社会状态扭转。显然，lgbt的时机还没到。当然，第三点不绝对，但是我现在真的看不到成功的希望。所以，我觉得我们这些人现在最需要做的是改变大众对我们的印象。比如很多人一想起男同就会想到艾滋滥交，那我们就洁身自好。有些人觉得同性恋不能生孩子会很惨，那你就多赚点钱，过的比他们都好。还有骗婚等等，也不能做。我相信一旦我们撕掉了这些不好的标签，我们被接受的程度将会提高很多，至少这些标签不会再变成别人攻击我们的理由。最后说一下zz立场的问题。女装jzy的恶臭言论曝光时，我就知道lgbt又要受到质疑了。但其实立场和性取向没有关系，很多人说同性恋很多恨国，这种观点其实和同性恋都很娘的论调犯了同一个错误。你总觉得你看到的同性恋大部分恨国或者娘，其实是因为这些人存在感比较强。爱国的人不会天天说自己爱国，只有恨国的人才会天天发牢骚和谩骂，所以你只看到恨国的人。同样的，很多man的gay你根本看不出他是gay，所以你才会觉得gay几乎都是娘的。
319090387,33,守望西南,未知,447,https://www.zhihu.com/people/zan-tui-xi-nan-shou-wang-zhe,,1311685155,2020-06-30 18:00:27,1,7,3,很难。LGBT运动与理念已经与政治正确捆绑，但现在世界逐渐右倾，“反政治正确正在成为新的政治正确”，LGBT运动必然会连带遭到打击。想要在未来被中国居民广泛接受，不仅仅是靠时间，他们很可能真的得与原本的话语体系解绑，重新走一条符合中国国情的特色道路。（PS：我个人认为他们首先得把身上的戾气收一下，虽然网络本就是发泄情绪，但做宣传动不动就急眼了，效果是不会好的。。。）
319090387,33,Ashina Kroran,未知,6,https://www.zhihu.com/people/mustaqqqqqq,,1322136747,2020-07-06 10:50:23,0,9,1,奉劝某些别有用心的家伙别把LGB和T，还有什么Q啊I的绑起来，蟹蟹。本B不屑于跟T那群玩意为伍，小众就是小众，非给我们强塞队友是几个意思？看见前排那一大堆义愤填膺说什么「团体是现代政治的必需属性」，批判「敌视团体」的←壬，我就笑了，强加给我们一个团体，我不满意，还不行了？？？ps 白左整天搞黑命贵的时候不带着黄皮一起贵，搞什么LGBT大联合倒是谁都想带。这不是堂而皇之诈骗，有这么双标的平等？某些LGB兄弟姐妹真当白左是带善人了？
319090387,33,匿名用户,男,0,https://www.zhihu.com/people/,,772495673,2019-08-02 13:03:40,0,9,0,就题目而言，不可能，永远不可能！我们是十多亿的人口，不可能做到每个人都去接受去支持。同时，是否接受和支持，都只是个人的选择，这个选择是自由的，只要他不违反法律。那么换个问法答一下，LGBT团体会不会被我们的法律承认，给予同异性恋群体一样的婚姻保护？就目前看，不太现实。现在我们内部面临着老龄化，生育率低，经济低迷等问题。外在还有因为近些年的崛起，注定要成为围剿对象的忧患。虽然从经济上看，是长期利好。但对我们的制裁和限制是很难消失的。（最近美国总统在大选，说实在，就算换一个总统，为了国家利益，还是会限制我们。如果在某位总统任期内我们超越了美国，这会是他永远洗不掉的政治黑点，而且前人的错误也都会被归结到他的身上。）那么在这么棘手的环境下，LGBT的平权问题，会是被首要考虑的吗？显然不是，这个时候我们该冲分发挥“集中力量干大事”的优势去集中应对外部困境。简单点讲，就是国家没空。再次回到问题上来，“法不禁止即可为”。我们并没有对LGBT做出任何国家层面的限制，只是我们没有给这个群体的结合给予法律保护，也就是不保护。      短期看，国家的态度就是：不限制，不保护（国家的态度是会变化的，希望有一天我能再次上来补充些有趣的消息。同时希望那个时候知乎还在。）        在感情层面上讲，是否选择相伴是两个人的事情。严格讲，两个人的结合与国家无关，是双方自愿产生的结果。在我个人来看，如果真能相伴一生，那一纸文书，不要也罢。当然，没有国家保护，生活可能会比较棘手。毕竟从法律上来说，双方还是单身汉，哪怕你与爱人已经  举案齐眉数十载，两头青丝共白发  所以，做好经济规划吧。毕竟，有钱真的可以为所欲为！贫贱夫妻百事哀，莫要如此！
